Sport,Team,Product ID,Product Name,Product Price
NFL,indianapolis-colts,p-4538160,"Indianapolis Colts Newborn & Infant Little Champ Three-Piece Bodysuit, Bib & Booties Set - Royal/Gray",$29.99
NFL,indianapolis-colts,p-4478440,Newborn & Infant Royal Indianapolis Colts Sherpa Full-Zip Sleeper,$29.99
NFL,indianapolis-colts,p-5340082,Indianapolis Colts Newborn & Infant Two-Pack Double Up Bodysuit Set - Royal/Gray,$25.99
NFL,indianapolis-colts,p-3889516,Indianapolis Colts '47 Infant Bam Bam Cuffed Knit Hat With Pom and Mittens Set - Royal/White,$29.99
NFL,indianapolis-colts,p-4981884,Indianapolis Colts Infant Tailgate Tutu Game Day Costume Set - Royal/White,$34.99
NFL,indianapolis-colts,p-4683063,Indianapolis Colts New Era Infant Mini Fan Beanie -  Royal,$19.99
NFL,jacksonville-jaguars,p-3143073,"Jacksonville Jaguars Newborn & Infant Eat, Sleep, Drool Football Three-Piece Bodysuit Set - Black/Teal",$29.99
NFL,jacksonville-jaguars,p-4777500,Jacksonville Jaguars Infant Winning Streak T-Shirt - Black,$12.99
NFL,jacksonville-jaguars,p-4333480,Trevor Lawrence Jacksonville Jaguars Nike Infant Game Jersey - Teal,$49.99
NFL,jacksonville-jaguars,p-4347691,Jacksonville Jaguars Newborn & Infant 3rd Down & Goal Three-Piece Bodysuit Set - Black/Teal/Heathered Gray,$29.99
NFL,jacksonville-jaguars,p-4539067,Jacksonville Jaguars Newborn & Infant Too Much Love Two-Piece Bodysuit Set - Black/Teal,$29.99
NFL,jacksonville-jaguars,p-4538165,"Jacksonville Jaguars Newborn & Infant Little Champ Three-Piece Bodysuit, Bib & Booties Set - Black/Teal",$29.99
NFL,jacksonville-jaguars,p-2085628,Jacksonville Jaguars Infant Piped Raglan Full-Zip Sleeper - Black,$24.99
NFL,jacksonville-jaguars,p-2069409,Jacksonville Jaguars Infant Team Logo T-Shirt - Black,$15.99
NFL,jacksonville-jaguars,p-4542271,Jacksonville Jaguars Infant 3-Pack Game On Bodysuit Set - Black/Teal/Heathered Gray,$29.99
NFL,jacksonville-jaguars,p-1346716,Jacksonville Jaguars Newborn & Infant Team Logo Bodysuit - Black,$19.99
NFL,jacksonville-jaguars,p-4449048,Trevor Lawrence Jacksonville Jaguars Infant Mainliner Player Name & Number Bodysuit - Black,$23.99
NFL,jacksonville-jaguars,p-4476815,Jacksonville Jaguars Infant Wordmark Logo Bodysuit - Black,$24.99
NFL,jacksonville-jaguars,p-4538133,Jacksonville Jaguars Newborn & Infant Born To Win Two-Pack Long Sleeve Bodysuit Set - Black/Heathered Gray,$29.99
NFL,jacksonville-jaguars,p-4753150,Jacksonville Jaguars WinCraft Newborn & Infant Rainbow Baby Bib,$8.24
NFL,jacksonville-jaguars,p-4445966,Jacksonville Jaguars Newborn & Infant Little Player Long Sleeve 2-Pack Bodysuit Set - Teal/Black,$29.99
NFL,jacksonville-jaguars,p-4347948,Jacksonville Jaguars Infant Touchdown Raglan Long Sleeve Bodysuit & Pants Set - Teal/Black,$34.99
NFL,jacksonville-jaguars,p-4537904,"Jacksonville Jaguars Dream Team Newborn & Infant Bodysuit, Pants & Hat Set - White/Black",$29.99
NFL,kansas-city-chiefs,p-3314177,Patrick Mahomes Kansas City Chiefs Nike Infant Game Jersey - Red,$49.99
NFL,kansas-city-chiefs,p-3143067,"Kansas City Chiefs Newborn & Infant Eat, Sleep, Drool Football Three-Piece Bodysuit Set - Red/Yellow",$29.99
NFL,kansas-city-chiefs,p-3548335,Patrick Mahomes Kansas City Chiefs Nike Infant Romper Jersey - Red,$49.99
NFL,kansas-city-chiefs,p-5333584,Kansas City Chiefs WinCraft Infant Super Bowl LVII Champions All Pro Baby Bib,$7.99
NFL,kansas-city-chiefs,p-3252888,Patrick Mahomes Kansas City Chiefs Infant Mainliner Name and Number Bodysuit - Red,$23.99
NFL,kansas-city-chiefs,p-1346709,Kansas City Chiefs Newborn & Infant Team Logo Bodysuit - Red,$19.99
NFL,kansas-city-chiefs,p-2499300,Kansas City Chiefs WinCraft Infant Lil Fan All Pro Baby Bib,$7.49
NFL,kansas-city-chiefs,p-4538159,"Kansas City Chiefs Newborn & Infant Little Champ Three-Piece Bodysuit, Bib & Booties Set - Red/Gold",$29.99
NFL,kansas-city-chiefs,p-4537897,"Kansas City Chiefs Dream Team Newborn & Infant Bodysuit, Pants & Hat Set - White/Red",$29.99
NFL,kansas-city-chiefs,p-1345462,Kansas City Chiefs Infant Team Logo T-Shirt - Red,$15.99
NFL,kansas-city-chiefs,p-3879461,Kansas City Chiefs Infant's My First Pixel Slouch Flex Hat - Yellow,$17.99
NFL,kansas-city-chiefs,p-4539060,Kansas City Chiefs Newborn & Infant Too Much Love Two-Piece Bodysuit Set - Red/Yellow,$29.99
NFL,kansas-city-chiefs,p-4430735,"Girls Infant White/Red Kansas City Chiefs Bodysuit, Bib & Booties Set",$26.99
NFL,kansas-city-chiefs,p-4542301,Kansas City Chiefs Girls Newborn & Infant Cutest Fan Bodysuit - Pink,$19.99
NFL,kansas-city-chiefs,p-4539379,Kansas City Chiefs Newborn & Infant Little Fan Bodysuit - Heathered Gray,$19.99
NFL,kansas-city-chiefs,p-4885679,Kansas City Chiefs Newborn & Infant Disney Lil Champ Bodysuit - Red,$21.99
NFL,kansas-city-chiefs,p-5015539,Newborn & Infant Kansas City Chiefs Cream Logo Hoodie Full-Zip Sleeper,$30.00
NFL,kansas-city-chiefs,p-4291269,"Kansas City Chiefs Newborn & Infant Bodysuit, Bib & Cap Set - Red/White",$19.99
NFL,kansas-city-chiefs,p-4430792,Newborn & Infant Red/Gold/Heathered Gray Kansas City Chiefs Three-Piece Bodysuit Set,$26.99
NFL,kansas-city-chiefs,p-4478466,Newborn & Infant Red Kansas City Chiefs Bodysuit,$19.99
NFL,kansas-city-chiefs,p-5015519,Newborn & Infant Red/Gold/Heather Gray Kansas City Chiefs Three-Pack Team Wordmark Bodysuit Set,$27.99
NFL,kansas-city-chiefs,p-4885707,Kansas City Chiefs Newborn Star Wars Stay On Target Bodysuit - Red,$21.99
NFL,kansas-city-chiefs,p-4478503,Girls Newborn & Infant Red/Gold Kansas City Chiefs Two-Piece Cheerleader Set with Bloomers,$24.97
NFL,kansas-city-chiefs,p-4762021,Kansas City Chiefs Infant Winning Streak T-Shirt - Red,$12.99
NFL,kansas-city-chiefs,p-3960541,Kansas City Chiefs Newborn & Infant Field 2-Pack Bodysuit Set - Red/Green,$17.99
NFL,kansas-city-chiefs,p-4537990,Kansas City Chiefs Girls Newborn & Infant Spreading Love Bodysuit and Tutu Leggings Set - White,$29.99
NFL,kansas-city-chiefs,p-4538126,Kansas City Chiefs Newborn & Infant Born To Win Two-Pack Long Sleeve Bodysuit Set - Red/Heathered Gray,$29.99
NFL,kansas-city-chiefs,p-3975751,Kansas City Chiefs Newborn & Infant Little Player Long Sleeve 2-Pack Bodysuit Set - Yellow/Red,$29.99
NFL,las-vegas-raiders,p-3143081,"Las Vegas Raiders Newborn & Infant Eat, Sleep, Drool Football Three-Piece Bodysuit Set - Black/Gray",$29.99
NFL,las-vegas-raiders,p-4538173,"Las Vegas Raiders Newborn & Infant Little Champ Three-Piece Bodysuit, Bib & Booties Set - Black/Silver",$29.99
NFL,las-vegas-raiders,p-4560758,Darren Waller Las Vegas Raiders Nike Infant Player Game Jersey - Black,$24.99
NFL,las-vegas-raiders,p-4560967,Darren Waller Las Vegas Raiders Nike Newborn & Infant Game Romper Jersey - Black,$24.99
NFL,las-vegas-raiders,p-1324627,Las Vegas Raiders Newborn Full Zip Raglan Coverall - Black,$24.99
NFL,las-vegas-raiders,p-1346722,Las Vegas Raiders Newborn & Infant Team Logo Bodysuit - Black,$19.99
NFL,las-vegas-raiders,p-1345473,Las Vegas Raiders Infant Team Logo T-Shirt - Black,$15.99
NFL,las-vegas-raiders,p-5016147,Davante Adams Las Vegas Raiders Newborn & Infant Team Player Bodysuit - Black,$22.99
NFL,las-vegas-raiders,p-4542314,Las Vegas Raiders Girls Newborn & Infant Cutest Fan Bodysuit - Pink,$19.99
NFL,las-vegas-raiders,p-4539073,Las Vegas Raiders Newborn & Infant Too Much Love Two-Piece Bodysuit Set - Black/Gray,$29.99
NFL,las-vegas-raiders,p-5101627,Davante Adams Las Vegas Raiders Newborn & Infant Mainliner Player Name & Number Bodysuit - Black,$23.99
NFL,las-vegas-raiders,p-4683284,Las Vegas Raiders New Era Infant Critter Cuffed Knit Hat - Heather Gray,$21.99
NFL,las-vegas-raiders,p-4762031,Las Vegas Raiders Infant Winning Streak T-Shirt - Black,$12.99
NFL,las-vegas-raiders,p-4538003,Las Vegas Raiders Girls Newborn & Infant Spreading Love Bodysuit and Tutu Leggings Set - White,$29.99
NFL,las-vegas-raiders,p-5340089,Las Vegas Raiders Newborn & Infant Two-Pack Double Up Bodysuit Set - Black/Gray,$25.99
NFL,las-vegas-raiders,p-4537910,"Las Vegas Raiders Dream Team Newborn & Infant Bodysuit, Pants & Hat Set - White/Black",$29.99
NFL,las-vegas-raiders,p-4538141,Las Vegas Raiders Newborn & Infant Born To Win Two-Pack Long Sleeve Bodysuit Set - Black/Heathered Gray,$29.99
NFL,las-vegas-raiders,p-1324772,Las Vegas Raiders Infant Piped Raglan Full Zip Coverall - Black,$24.99
NFL,las-vegas-raiders,p-4539392,Las Vegas Raiders Newborn & Infant Little Fan Bodysuit - Heathered Gray,$19.99
NFL,las-vegas-raiders,p-4981888,Las Vegas Raiders Infant Tailgate Tutu Game Day Costume Set - Black/Silver,$34.99
NFL,las-vegas-raiders,p-3730418,Josh Jacobs Las Vegas Raiders Newborn & Infant Mainliner Name & Number Bodysuit - Black,$23.99
NFL,las-vegas-raiders,p-4539011,Las Vegas Raiders Girls Infant Heart to Heart Jersey Tri-Blend Dress - Black/Silver,$29.99
NFL,las-vegas-raiders,p-3730438,Josh Jacobs Las Vegas Raiders Infant Mainliner Name & Number Bodysuit - Black,$23.99
NFL,las-vegas-raiders,p-4478469,Newborn & Infant Black Las Vegas Raiders Bodysuit,$19.99
NFL,las-vegas-raiders,p-5101619,Davante Adams Las Vegas Raiders Infant Mainliner Player Name & Number Bodysuit - Black,$23.99
NFL,las-vegas-raiders,p-5015526,Newborn & Infant Black/Silver/Heather Gray Las Vegas Raiders Three-Pack Team Wordmark Bodysuit Set,$27.99
NFL,las-vegas-raiders,p-4478516,Girls Newborn & Infant Black/Silver Las Vegas Raiders Two-Piece Cheerleader Set with Bloomers,$24.97
NFL,las-vegas-raiders,p-4260785,Las Vegas Raiders Newborn & Infant Slouch Flex Hat - Black,$19.99
NFL,las-vegas-raiders,p-4064578,Las Vegas Raiders Girls Infant Too Cute Long Sleeve Bodysuit & Pants Set - Red,$24.99
NFL,las-vegas-raiders,p-4556180,Las Vegas Raiders Infant My First Tail Sweep Slouch Flex Hat - Black/Silver,$19.99
NFL,los-angeles-chargers,p-4128631,Justin Herbert Los Angeles Chargers Nike Infant Game Jersey - Powder Blue,$49.99
NFL,los-angeles-chargers,p-4408961,Justin Herbert Los Angeles Chargers Nike Infant Game Romper Jersey - Powder Blue,$49.99
NFL,los-angeles-chargers,p-4538168,"Los Angeles Chargers Newborn & Infant Little Champ Three-Piece Bodysuit, Bib & Booties Set - Powder Blue/Gray",$29.99
NFL,los-angeles-chargers,p-4952997,"Los Angeles Chargers Newborn & Infant Three-Piece Eat, Sleep, Drool Bodysuit Set - Powder Blue/White/Heather Gray",$29.99
NFL,los-angeles-chargers,p-4762020,Los Angeles Chargers Infant Winning Streak T-Shirt - Heathered Gray,$12.99
NFL,los-angeles-chargers,p-3915077,Los Angeles Chargers Infant Team Logo Creeper - Powder Blue,$19.99
NFL,los-angeles-chargers,p-5340081,Los Angeles Chargers Newborn & Infant Two-Pack Double Up Bodysuit Set - Powder Blue/Gray,$25.99
NFL,los-angeles-chargers,p-4260677,Justin Herbert Los Angeles Chargers Newborn & Infant Mainliner Player Name & Number Bodysuit - Powder Blue,$23.99
NFL,los-angeles-chargers,p-4260685,Justin Herbert Los Angeles Chargers Infant Mainliner Player Name & Number Bodysuit - Powder Blue,$23.99
NFL,los-angeles-chargers,p-3915074,Los Angeles Chargers Infant Team Primary Logo T-Shirt - Powder Blue,$15.99
NFL,los-angeles-chargers,p-4537989,Los Angeles Chargers Girls Newborn & Infant Spreading Love Bodysuit and Tutu Leggings Set - White,$29.99
NFL,los-angeles-chargers,p-4556172,Los Angeles Chargers Infant My First Tail Sweep Slouch Flex Hat - Powder Blue/Gray,$19.99
NFL,los-angeles-chargers,p-3269658,Los Angeles Chargers WinCraft Disney Mickey All Pro Baby Bib,$7.99
NFL,los-angeles-chargers,p-2560963,Los Angeles Chargers For Bare Feet Infant Team Color Rugby Block Socks - Navy/White,$8.99
NFL,los-angeles-rams,p-3998151,Aaron Donald Los Angeles Rams Nike Infant Game Jersey - Royal,$49.99
NFL,los-angeles-rams,p-4408963,Aaron Donald Los Angeles Rams Nike Infant Game Romper Jersey - Royal,$49.99
NFL,los-angeles-rams,p-4952998,"Los Angeles Rams Newborn & Infant Three-Piece Eat, Sleep, Drool Bodysuit Set - Royal/Gold/Heathered Gray",$29.99
NFL,los-angeles-rams,p-4554387,Los Angeles Rams Infant Slouch Flex Hat - Royal,$19.99
NFL,los-angeles-rams,p-4538169,"Los Angeles Rams Newborn & Infant Little Champ Three-Piece Bodysuit, Bib & Booties Set - Royal/Gold",$29.99
NFL,los-angeles-rams,p-4981887,Los Angeles Rams Infant Tailgate Tutu Game Day Costume Set - Royal/White,$34.99
NFL,los-angeles-rams,p-3364263,Los Angeles Rams NFL Team Rattle,$21.99
NFL,los-angeles-rams,p-3914657,Los Angeles Rams Infant Team Logo Bodysuit - Royal,$19.99
NFL,los-angeles-rams,p-3914624,Los Angeles Rams Infant Team Logo T-Shirt - Royal,$15.99
NFL,los-angeles-rams,p-4003466,Los Angeles Rams Infant Raglan Full-Zip Sleeper - Royal,$24.99
NFL,los-angeles-rams,p-4537911,"Los Angeles Rams Dream Team Newborn & Infant Bodysuit, Pants & Hat Set - White/Royal",$29.99
NFL,los-angeles-rams,p-4539074,Los Angeles Rams Newborn & Infant Too Much Love Two-Piece Bodysuit Set - Royal/Gold,$29.99
NFL,los-angeles-rams,p-4478445,Newborn & Infant Royal Los Angeles Rams Sherpa Full-Zip Sleeper,$29.99
NFL,los-angeles-rams,p-4478461,Newborn & Infant Royal/White/Heathered Gray Los Angeles Rams Three-Piece Bodysuit Set,$26.99
NFL,los-angeles-rams,p-4003471,Los Angeles Rams Newborn & Infant Raglan Full-Zip Sleeper - Royal,$24.99
NFL,los-angeles-rams,p-4478468,Newborn & Infant Navy Los Angeles Rams Bodysuit,$19.99
NFL,los-angeles-rams,p-4539043,"Los Angeles Rams Girls Newborn & Infant All The Love Bodysuit, Bib & Booties Set - Royal/Heathered Gray",$29.99
NFL,los-angeles-rams,p-4538004,Los Angeles Rams Girls Newborn & Infant Spreading Love Bodysuit and Tutu Leggings Set - White,$29.99
NFL,los-angeles-rams,p-4539331,Los Angeles Rams Girls Infant Cutest Fan T-Shirt - Pink,$15.99
NFL,los-angeles-rams,p-4710789,Los Angeles Rams Fanatics Branded Infant Super Bowl LVI Champions Parade Bodysuit - Royal,$14.99
NFL,los-angeles-rams,p-4539012,Los Angeles Rams Girls Infant Heart to Heart Jersey Dress - Royal/Gold,$29.99
NFL,los-angeles-rams,p-4338775,Los Angeles Rams New Era Infant Mini Fan Beanie - Royal,$19.99
NFL,los-angeles-rams,p-4762032,Los Angeles Rams Infant Winning Streak T-Shirt - Royal,$12.99
NFL,los-angeles-rams,p-4753154,Los Angeles Rams WinCraft Newborn & Infant Rainbow Baby Bib,$8.24
NFL,los-angeles-rams,p-3972059,"Los Angeles Rams Newborn & Infant Play Your Best Bodysuit, Bib & Booties Set - Royal",$29.99
NFL,los-angeles-rams,p-4538105,Los Angeles Rams Infant Little Kicker Long Sleeve Bodysuit & Pants Set - Royal/Gold,$29.99
NFL,los-angeles-rams,p-4538137,Los Angeles Rams Newborn & Infant Born To Win Two-Pack Long Sleeve Bodysuit Set - Royal/Heathered Gray,$29.99
NFL,miami-dolphins,p-1345465,Miami Dolphins Infant Team Logo T-Shirt - Aqua,$11.19
NFL,miami-dolphins,p-4762024,Miami Dolphins Infant Winning Streak T-Shirt - Heathered Gray,$12.99
NFL,miami-dolphins,p-3143069,"Miami Dolphins Newborn & Infant Eat, Sleep, Drool Football Three-Piece Bodysuit Set - Aqua/Orange",$29.99
NFL,miami-dolphins,p-4560964,Jaylen Waddle Miami Dolphins Nike Newborn & Infant Game Romper Jersey - Aqua,$49.99
NFL,miami-dolphins,p-5340084,Miami Dolphins Newborn & Infant Two-Pack Double Up Bodysuit Set - Aqua/Gray,$25.99
NFL,miami-dolphins,p-4537994,Miami Dolphins Girls Newborn & Infant Spreading Love Bodysuit and Tutu Leggings Set - White,$29.99
NFL,miami-dolphins,p-1346712,Miami Dolphins Newborn & Infant Team Logo Bodysuit - Aqua,$19.99
NFL,miami-dolphins,p-4538161,"Miami Dolphins Newborn & Infant Little Champ Three-Piece Bodysuit, Bib & Booties Set - Aqua/Orange",$29.99
NFL,miami-dolphins,p-2068762,Miami Dolphins Newborn & Infant Team Logo Bodysuit - Orange,$19.99
NFL,miami-dolphins,p-5101615,Tyreek Hill Miami Dolphins Infant Mainliner Player Name & Number Bodysuit - Aqua,$23.99
NFL,miami-dolphins,p-3960213,Tua Tagovailoa Miami Dolphins Newborn Mainliner Player Name & Number Bodysuit - Aqua,$23.99
NFL,miami-dolphins,p-3960215,Tua Tagovailoa Miami Dolphins Infant Mainliner Player Name & Number Bodysuit - Aqua,$23.99
NFL,miami-dolphins,p-5129167,Dan Marino Miami Dolphins Mitchell & Ness Infant Mainliner Retired Player Name & Number Bodysuit - Aqua,$27.99
NFL,miami-dolphins,p-5101623,Tyreek Hill Miami Dolphins Newborn & Infant Mainliner Player Name & Number Bodysuit - Aqua,$23.99
NFL,miami-dolphins,p-3972109,"Miami Dolphins Newborn & Infant Tackle Bodysuit, Bib & Booties Set - Aqua",$29.99
NFL,miami-dolphins,p-4471550,Dan Marino Miami Dolphins Mitchell & Ness Infant 1984 Retired Legacy Jersey - Aqua,$74.99
NFL,miami-dolphins,p-4409111,Tua Tagovailoa Miami Dolphins Nike Newborn & Infant Game Romper Jersey - Aqua,$49.99
NFL,minnesota-vikings,p-4471551,Randy Moss Minnesota Vikings Mitchell & Ness Infant 1998 Retired Legacy Jersey - Purple,$74.99
NFL,minnesota-vikings,p-3143089,"Minnesota Vikings Newborn & Infant Eat, Sleep, Drool Football Three-Piece Bodysuit Set - Purple/Gold",$29.99
NFL,minnesota-vikings,p-4067900,Minnesota Vikings New Era Newborn & Infant My 1st 9TWENTY Flex Hat - Purple,$19.99
NFL,minnesota-vikings,p-4449039,Justin Jefferson Minnesota Vikings Newborn & Infant Mainliner Player Name & Number Bodysuit - Purple,$23.99
NFL,minnesota-vikings,p-4538180,"Minnesota Vikings Newborn & Infant Little Champ Three-Piece Bodysuit, Bib & Booties Set - Purple/Gold",$29.99
NFL,minnesota-vikings,p-4538011,Minnesota Vikings Girls Newborn & Infant Spreading Love Bodysuit and Tutu Leggings Set - White,$29.99
NFL,minnesota-vikings,p-4449051,Justin Jefferson Minnesota Vikings Infant Mainliner Player Name & Number Bodysuit - Purple,$23.99
NFL,minnesota-vikings,p-4294785,Infant Purple Minnesota Vikings Football T-Shirt,$10.99
NFL,minnesota-vikings,p-4539050,"Minnesota Vikings Girls Newborn & Infant All The Love Bodysuit, Bib & Booties Set - Purple/Heathered Gray",$29.99
NFL,minnesota-vikings,p-1346731,Minnesota Vikings Newborn & Infant Team Logo Bodysuit - Purple,$19.99
NFL,minnesota-vikings,p-1345480,Minnesota Vikings Infant Team Logo T-Shirt - Purple,$15.99
NFL,minnesota-vikings,p-4430743,"Girls Infant White/Purple Minnesota Vikings Bodysuit, Bib & Booties Set",$26.99
NFL,minnesota-vikings,p-5340091,Minnesota Vikings Newborn & Infant Two-Pack Double Up Bodysuit Set - Purple/Gray,$25.99
NFL,minnesota-vikings,p-4291275,"Minnesota Vikings Newborn & Infant Bodysuit, Bib & Cap Set - Purple/White",$19.99
NFL,minnesota-vikings,p-5015552,Newborn & Infant Minnesota Vikings Cream Logo Hoodie Full-Zip Sleeper,$30.00
NFL,minnesota-vikings,p-5015532,Infant Purple/Gold/Heather Gray Minnesota Vikings Three-Pack Team Wordmark Bodysuit Set,$27.99
NFL,minnesota-vikings,p-4717102,Randy Moss Minnesota Vikings Mitchell & Ness Newborn & Infant Retro Name & Number Bodysuit - Purple,$27.99
NFL,minnesota-vikings,p-3975766,Minnesota Vikings Newborn & Infant Little Player Long Sleeve 2-Pack Bodysuit Set - Gold/Purple,$29.99
NFL,minnesota-vikings,p-4064697,"Minnesota Vikings Infant My Little Present Bodysuit, Bib & Booties Set - White/Purple",$17.99
NFL,minnesota-vikings,p-4885701,Minnesota Vikings Newborn & Infant Disney Lil Champ Bodysuit - Purple,$21.99
NFL,minnesota-vikings,p-4430801,Newborn & Infant Purple/Gold/Heathered Gray Minnesota Vikings Three-Piece Bodysuit Set,$26.99
NFL,minnesota-vikings,p-3238679,Dalvin Cook Minnesota Vikings Nike Infant Player Game Jersey - Purple,$44.99
NFL,minnesota-vikings,p-4538148,Minnesota Vikings Newborn & Infant Born To Win Two-Pack Long Sleeve Bodysuit Set - Purple/Heathered Gray,$29.99
NFL,minnesota-vikings,p-4539081,Minnesota Vikings Newborn & Infant Too Much Love Two-Piece Bodysuit Set - Purple/Gold,$29.99
NFL,minnesota-vikings,p-5016148,Dalvin Cook Minnesota Vikings Newborn & Infant Team Player Bodysuit - Purple,$22.99
NFL,minnesota-vikings,p-3587074,Minnesota Vikings Girls Newborn Lil' Princess Bodysuit and Tutu Leggings Set - White/Pink,$27.99
NFL,minnesota-vikings,p-3965444,Dalvin Cook Minnesota Vikings Infant Mainliner Player Name & Number Bodysuit - Purple,$21.99
NFL,minnesota-vikings,p-4981890,Minnesota Vikings Infant Tailgate Tutu Game Day Costume Set - Purple/White,$34.99
NFL,new-england-patriots,p-3143080,"New England Patriots Newborn & Infant Eat, Sleep, Drool Football Three-Piece Bodysuit Set - Navy/Red",$29.99
NFL,new-england-patriots,p-4560966,Mac Jones New England Patriots Nike Newborn & Infant Game Romper Jersey - Navy,$49.99
NFL,new-england-patriots,p-3889520,New England Patriots '47 Infant Bam Bam Cuffed Knit Hat With Pom and Mittens Set - Navy/Red,$29.99
NFL,new-england-patriots,p-4294778,Infant Navy New England Patriots Football T-Shirt,$4.99
NFL,new-england-patriots,p-1324626,New England Patriots Newborn Full Zip Raglan Coverall - Navy Blue,$24.99
NFL,new-england-patriots,p-4537970,New England Patriots Newborn & Infant Game Nap Teddy Fleece Bunting Full-Zip Sleeper - Navy/Gray,$39.99
NFL,new-england-patriots,p-4981891,New England Patriots Infant Tailgate Tutu Game Day Costume Set - Navy,$34.99
NFL,new-england-patriots,p-4542275,New England Patriots Infant 3-Pack Game On Bodysuit Set - Navy/Red/Heathered Gray,$29.99
NFL,new-england-patriots,p-1345472,New England Patriots Infant Team Logo T-Shirt - Navy Blue,$15.99
NFL,new-england-patriots,p-4537908,"New England Patriots Dream Team Newborn & Infant Bodysuit, Pants & Hat Set - White/Navy",$29.99
NFL,new-england-patriots,p-4683051,New England Patriots New Era Infant Mini Fan Beanie - Navy,$19.99
NFL,new-england-patriots,p-3174072,Newborn & Infant Navy New England Patriots Mesh Jersey T-Shirt,$13.99
NFL,new-england-patriots,p-4539040,"New England Patriots Girls Newborn & Infant All The Love Bodysuit, Bib & Booties Set - Navy/Heathered Gray",$29.99
NFL,new-england-patriots,p-1346721,New England Patriots Newborn & Infant Team Logo Bodysuit - Navy,$19.99
NFL,new-england-patriots,p-4538172,"New England Patriots Newborn & Infant Little Champ Three-Piece Bodysuit, Bib & Booties Set - Navy/Red",$29.99
NFL,new-england-patriots,p-3174091,Newborn & Infant Navy New England Patriots Receiver T-Shirt,$7.99
NFL,new-england-patriots,p-1324771,New England Patriots Infant Piped Raglan Full Zip Coverall - Navy Blue,$24.99
NFL,new-england-patriots,p-5101625,Mac Jones New England Patriots Newborn & Infant Mainliner Player Name & Number Bodysuit - Navy,$23.99
NFL,new-england-patriots,p-5015544,Newborn & Infant New England Patriots Cream Logo Hoodie Full-Zip Sleeper,$30.00
NFL,new-england-patriots,p-5015320,Newborn & Infant Navy New England Patriots Allover Print Full-Zip Footed Jumper,$18.00
NFL,new-england-patriots,p-3172630,Girls Newborn & Infant Navy/Red/White New England Patriots Team 3-Pack Bodysuit Set,$16.99
NFL,new-england-patriots,p-4478448,Newborn & Infant Navy New England Patriots Sherpa Full-Zip Sleeper,$29.99
NFL,new-england-patriots,p-5015524,Infant Navy/Red/Heather Gray New England Patriots Three-Pack Team Wordmark Bodysuit Set,$27.99
NFL,new-england-patriots,p-4478511,Girls Newborn & Infant Navy/Red New England Patriots Two-Piece Cheerleader Set with Bloomers,$24.97
NFL,new-england-patriots,p-3998152,Julian Edelman New England Patriots Nike Infant Game Jersey - Navy,$44.99
NFL,new-england-patriots,p-3174141,Infant Heathered Gray New England Patriots Crew Neck T-Shirt,$7.99
NFL,new-england-patriots,p-4539009,New England Patriots Girls Infant Heart to Heart Jersey Tri-Blend Dress - Navy/Red,$29.99
NFL,new-england-patriots,p-3960810,New England Patriots Girls Infant All Hearts Jersey Long Sleeve Dress - Navy,$29.99
NFL,new-england-patriots,p-4538140,New England Patriots Newborn & Infant Born To Win Two-Pack Long Sleeve Bodysuit Set - Navy/Heathered Gray,$29.99
NFL,new-england-patriots,p-4539071,New England Patriots Newborn & Infant Too Much Love Two-Piece Bodysuit Set - Navy/Red,$29.99
NFL,new-england-patriots,p-4538001,New England Patriots Girls Newborn & Infant Spreading Love Bodysuit and Tutu Leggings Set - White,$29.99
NFL,new-england-patriots,p-3172018,Newborn & Infant Navy/Red/Gray New England Patriots Rookie 3-Pack Bodysuit Set,$13.99
NFL,new-england-patriots,p-5016149,Mac Jones New England Patriots Newborn & Infant Team Player Bodysuit - Navy,$22.99
NFL,new-england-patriots,p-3143109,New England Patriots Girls Infant Cheer Captain Jumper Dress - Navy/Red,$31.99
NFL,new-england-patriots,p-4762029,New England Patriots Infant Winning Streak T-Shirt - Navy,$12.99
NFL,new-england-patriots,p-4064576,New England Patriots Girls Infant Too Cute Long Sleeve Bodysuit & Pants Set - Red,$20.99
NFL,new-england-patriots,p-5101617,Mac Jones New England Patriots Infant Mainliner Player Name & Number Bodysuit - Navy,$23.99
NFL,new-england-patriots,p-4683277,New England Patriots New Era Infant Critter Cuffed Knit Hat - Heather Gray,$21.99
NFL,new-england-patriots,p-3275448,New England Patriots Infant Two-Pack Booties Set,$7.99
NFL,new-england-patriots,p-4538108,New England Patriots Infant Little Kicker Long Sleeve Bodysuit & Pants Set - Navy/Red,$29.99
NFL,new-england-patriots,p-3961121,New England Patriots Infant Champ 3-Pack Bodysuit Set - Navy/Red/Heathered Gray,$29.99
NFL,new-england-patriots,p-4717001,New England Patriots Newborn & Infant Monterey Tie-Dye 2-Pack Bodysuit Set - Red/White,$21.99
NFL,new-england-patriots,p-3962231,"New England Patriots Newborn & Infant Ready, Set, Nap Three-Pack Bodysuit Set - Navy/Red/Heathered Gray",$26.99
NFL,new-england-patriots,p-4432215,New England Patriots Newborn & Infant Long Sleeve T-Shirt - Navy,$11.99
NFL,new-england-patriots,p-4539359,New England Patriots Infant Hand-Off T-Shirt - Navy,$15.99
NFL,new-england-patriots,p-4556178,New England Patriots Infant My First Tail Sweep Slouch Flex Hat - Navy/Red,$19.99
NFL,new-england-patriots,p-3975758,New England Patriots Newborn & Infant Little Player Long Sleeve 2-Pack Bodysuit Set - Red/Navy,$29.99
NFL,new-england-patriots,p-2850967,New England Patriots Girls Infant Celebration Tutu Sequins Dress - Navy,$19.99
NFL,new-england-patriots,p-4478479,Girls Newborn & Infant Navy/Red/White New England Patriots Three-Piece Bodysuit Set,$26.99
NFL,new-orleans-saints,p-3143083,"New Orleans Saints Newborn & Infant Eat, Sleep, Drool Football Three-Piece Bodysuit Set - Black/Gold",$20.99
NFL,new-orleans-saints,p-1324630,New Orleans Saints Newborn Full Zip Raglan Coverall - Black,$17.49
