Sport,Team,Product ID,Product Name,Product Price
NFL,chicago-bears,p-4067869,Chicago Bears New Era Infant My 1st 9FIFTY Adjustable Hat - Navy/Orange,$23.99
NFL,chicago-bears,p-4885676,Chicago Bears Newborn & Infant Disney Lil Champ Bodysuit - Navy,$21.99
NFL,chicago-bears,p-3975749,Chicago Bears Newborn & Infant Little Player Long Sleeve 2-Pack Bodysuit Set - Orange/Navy,$29.99
NFL,chicago-bears,p-4538089,Chicago Bears Infant Little Kicker Long Sleeve Bodysuit & Pants Set - Navy/Orange,$29.99
NFL,chicago-bears,p-4537987,Chicago Bears Girls Newborn & Infant Spreading Love Bodysuit and Tutu Leggings Set - White,$29.99
NFL,chicago-bears,p-4556170,Chicago Bears Infant My First Tail Sweep Slouch Flex Hat - Navy/Orange,$19.99
NFL,chicago-bears,p-4067915,Chicago Bears New Era Newborn & Infant My 1st 9TWENTY Flex Hat - Navy,$19.99
NFL,chicago-bears,p-4542261,Chicago Bears Infant 3-Pack Game On Bodysuit Set - Navy/Orange/Heathered Gray,$29.99
NFL,chicago-bears,p-4981878,Chicago Bears Infant Tailgate Tutu Game Day Costume Set - Navy/White,$34.99
NFL,cincinnati-bengals,p-4762017,Cincinnati Bengals Infant Winning Streak T-Shirt - Black,$12.99
NFL,cincinnati-bengals,p-4538154,"Cincinnati Bengals Newborn & Infant Little Champ Three-Piece Bodysuit, Bib & Booties Set - Black/Orange",$29.99
NFL,cincinnati-bengals,p-5340079,Cincinnati Bengals Newborn & Infant Two-Pack Double Up Bodysuit Set - Black/Gray,$25.99
NFL,cincinnati-bengals,p-3143062,"Cincinnati Bengals Newborn & Infant Eat, Sleep, Drool Football Three-Piece Bodysuit Set - Black/Orange",$29.99
NFL,cincinnati-bengals,p-1346704,Cincinnati Bengals Newborn & Infant Team Logo Bodysuit - Black,$19.99
NFL,cincinnati-bengals,p-1772567,Cincinnati Bengals Infant Team Logo T-Shirt - Black,$15.99
NFL,cleveland-browns,p-4260778,Cleveland Browns Newborn & Infant Slouch Flex Hat - Brown,$16.99
NFL,cleveland-browns,p-5016142,Nick Chubb Cleveland Browns Newborn & Infant Team Player Bodysuit - Brown,$22.99
NFL,cleveland-browns,p-4952995,"Cleveland Browns Newborn & Infant Three-Piece Eat, Sleep, Drool Bodysuit Set - Brown/Orange/Heathered Gray",$29.99
NFL,cleveland-browns,p-4556171,Cleveland Browns Infant My First Tail Sweep Slouch Flex Hat - Brown/Orange,$19.99
NFL,cleveland-browns,p-4537957,Cleveland Browns Newborn & Infant Game Nap Teddy Fleece Bunting Full-Zip Sleeper - Brown/Gray,$39.99
NFL,cleveland-browns,p-4537895,"Cleveland Browns Dream Team Newborn & Infant Bodysuit, Pants & Hat Set - White/Brown",$29.99
NFL,cleveland-browns,p-2085615,Cleveland Browns Infant Raglan Full-Zip Sleeper - Brown,$24.99
NFL,cleveland-browns,p-4539377,Cleveland Browns Newborn & Infant Little Fan Bodysuit - Heathered Gray,$19.99
NFL,cleveland-browns,p-4478477,Girls Newborn & Infant Brown/Orange/White Cleveland Browns Three-Piece Bodysuit Set,$26.99
NFL,cleveland-browns,p-4538157,"Cleveland Browns Newborn & Infant Little Champ Three-Piece Bodysuit, Bib & Booties Set - Brown/Orange",$29.99
NFL,cleveland-browns,p-1346707,Cleveland Browns Newborn & Infant Team Logo Bodysuit - Brown,$19.99
NFL,cleveland-browns,p-2068742,Cleveland Browns Infant Team Logo T-Shirt - Brown,$15.99
NFL,cleveland-browns,p-2444329,Cleveland Browns Infant Piped Raglan Full-Zip Sleeper - Brown,$24.99
NFL,cleveland-browns,p-4478457,Newborn & Infant Brown/Orange/Heathered Gray Cleveland Browns Three-Piece Bodysuit Set,$26.99
NFL,cleveland-browns,p-4716995,Cleveland Browns Newborn & Infant Monterey Tie-Dye 2-Pack Bodysuit Set - Orange/White,$21.99
NFL,cleveland-browns,p-5015518,Newborn & Infant Brown/Orange/Heather Gray Cleveland Browns Three-Pack Team Wordmark Bodysuit Set,$27.99
NFL,cleveland-browns,p-5015538,Newborn & Infant Cleveland Browns Cream Logo Hoodie Full-Zip Sleeper,$30.00
NFL,cleveland-browns,p-3592384,Cleveland Browns WinCraft Newborn & Infant Eat. Drink. Repeat. All-Pro Bib,$9.99
NFL,cleveland-browns,p-4478437,Newborn & Infant Brown Cleveland Browns Sherpa Full-Zip Sleeper,$29.99
NFL,cleveland-browns,p-5015314,Newborn & Infant Brown Cleveland Browns Allover Print Full-Zip Footed Jumper,$18.00
NFL,cleveland-browns,p-4539058,Cleveland Browns Newborn & Infant Too Much Love Two-Piece Bodysuit Set - Brown/Orange,$29.99
NFL,cleveland-browns,p-4270979,Cleveland Browns '47 Infant Team Bam Bam Cuffed Knit Hat With Pom and Mittens Set - Brown/Orange,$29.99
NFL,cleveland-browns,p-4539315,Cleveland Browns Girls Infant Cutest Fan T-Shirt - Pink,$15.99
NFL,cleveland-browns,p-4538996,Cleveland Browns Girls Infant Heart to Heart Jersey Tri-Blend Dress - Brown/Orange,$29.99
NFL,cleveland-browns,p-2068760,Cleveland Browns Newborn & Infant Team Logo Bodysuit - Orange,$19.99
NFL,cleveland-browns,p-4537988,Cleveland Browns Girls Newborn & Infant Spreading Love Bodysuit and Tutu Leggings Set - White,$29.99
NFL,cleveland-browns,p-3491809,Odell Beckham Jr. Cleveland Browns Nike Infant Game Player Jersey - Brown,$21.99
NFL,cleveland-browns,p-3148802,Baker Mayfield Cleveland Browns Newborn Mainliner Name & Number Bodysuit - Brown,$21.99
NFL,cleveland-browns,p-4542299,Cleveland Browns Girls Newborn & Infant Cutest Fan Bodysuit - Pink,$19.99
NFL,cleveland-browns,p-4762019,Cleveland Browns Infant Winning Streak T-Shirt - Heathered Gray,$12.99
NFL,cleveland-browns,p-4538124,Cleveland Browns Newborn & Infant Born To Win Two-Pack Long Sleeve Bodysuit Set - Brown/Heathered Gray,$29.99
NFL,cleveland-browns,p-4539346,Cleveland Browns Infant Hand-Off T-Shirt - Brown,$15.99
NFL,cleveland-browns,p-4885677,Cleveland Browns Newborn & Infant Disney Lil Champ Bodysuit - Brown,$21.99
NFL,cleveland-browns,p-4840352,Cleveland Browns '47 Infant Bam Bam Cuffed Knit Hat with Pom & Mittens Set - Brown/Orange,$29.99
NFL,cleveland-browns,p-3143096,Cleveland Browns Girls Infant Cheer Captain Jumper Dress - Brown/Orange,$31.99
NFL,cleveland-browns,p-4478502,Girls Newborn & Infant Brown/Orange Cleveland Browns Two-Piece Cheerleader Set with Bloomers,$24.97
NFL,cleveland-browns,p-4064683,"Cleveland Browns Infant My Little Present Bodysuit, Bib & Booties Set - White/Brown",$11.99
NFL,cleveland-browns,p-4981880,Cleveland Browns Infant Tailgate Tutu Game Day Costume Set - Brown/White,$34.99
NFL,cleveland-browns,p-4683070,Cleveland Browns New Era Infant Mini Fan Beanie -  Brown,$19.99
NFL,cleveland-browns,p-4542262,Cleveland Browns Infant 3-Pack Game On Bodysuit Set - Brown/Orange/Heathered Gray,$29.99
NFL,cleveland-browns,p-4539027,"Cleveland Browns Girls Newborn & Infant All The Love Bodysuit, Bib & Booties Set - Brown/Heathered Gray",$29.99
NFL,cleveland-browns,p-3148838,Baker Mayfield Cleveland Browns Infant Mainliner Name & Number Bodysuit - Brown,$10.99
NFL,dallas-cowboys,p-4923582,Dallas Cowboys Newborn & Infant Game Nap Teddy Fleece Bunting Full-Zip Sleeper - Navy/Gray,$39.99
NFL,dallas-cowboys,p-4939012,"Dallas Cowboys Newborn & Infant Three-Piece Eat, Sleep, Drool Bodysuit Set - Navy/Silver/Heathered Gray",$29.99
NFL,dallas-cowboys,p-5011378,Newborn & Infant Navy/Heather Gray/White Dallas Cowboys Three-Piece Bodysuit Set,$27.99
NFL,dallas-cowboys,p-4457539,CeeDee Lamb Dallas Cowboys Nike Infant Game Jersey Romper - Navy,$49.99
NFL,dallas-cowboys,p-4457536,Dak Prescott Dallas Cowboys Nike Infant Game Jersey Romper - Navy,$49.99
NFL,dallas-cowboys,p-4927696,"Dallas Cowboys Newborn & Infant Little Champ Three-Piece Bodysuit, Bib & Booties Set - Navy/Heathered Gray",$29.99
NFL,dallas-cowboys,p-4651242,Emmitt Smith Dallas Cowboys Mitchell & Ness Infant 1996 Retired Legacy Jersey - Navy,$74.99
NFL,dallas-cowboys,p-4564157,Trevon Diggs Dallas Cowboys Nike Infant Game Jersey - Navy,$49.99
NFL,dallas-cowboys,p-4457532,Dak Prescott Dallas Cowboys Nike Infant Player Game Jersey - Navy,$49.99
NFL,dallas-cowboys,p-200081340,Micah Parsons Dallas Cowboys Infant Mainliner Player Name & Number Bodysuit - Navy,$23.99
NFL,dallas-cowboys,p-4457535,CeeDee Lamb Dallas Cowboys Nike Infant Game Jersey - Navy,$49.99
NFL,dallas-cowboys,p-4057906,Dallas Cowboys New Era Infant My 1st 9FIFTY Adjustable Hat - Navy,$23.99
NFL,dallas-cowboys,p-4930378,Dallas Cowboys Girls Infant Heart to Heart Jersey Tri-Blend Dress - Navy/Heather Gray,$29.99
NFL,dallas-cowboys,p-5279148,Dallas Cowboys Newborn & Infant Two-Pack Double Up Bodysuit Set - Navy/Gray,$25.99
NFL,dallas-cowboys,p-200081552,Micah Parsons Dallas Cowboys Newborn Mainliner Player Name & Number Bodysuit - Navy,$23.99
NFL,dallas-cowboys,p-4982152,Dallas Cowboys New Era Infant My First 9TWENTY Flex Hat - Navy,$19.99
NFL,dallas-cowboys,p-4959604,Dallas Cowboys Newborn & Infant Too Much Love Two-Pack Bodysuit Set - Navy/Gray,$29.99
NFL,dallas-cowboys,p-5011906,Newborn & Infant Dak Prescott Navy Dallas Cowboys Logo Player Name & Number Bodysuit,$17.99
NFL,dallas-cowboys,p-2499305,Dallas Cowboys WinCraft Infant Lil Fan All Pro Baby Bib,$8.99
NFL,dallas-cowboys,p-4684697,Dallas Cowboys New Era Infant Critter Cuffed Knit Hat - Gray,$21.99
NFL,dallas-cowboys,p-4923555,"Dallas Cowboys Dream Team Newborn & Infant Bodysuit, Pants & Hat Set - White/Navy",$29.99
NFL,dallas-cowboys,p-4923581,Dallas Cowboys Girls Newborn & Infant Spreading Love Bodysuit and Tutu Leggings Set - White,$29.99
NFL,dallas-cowboys,p-5051097,Dallas Cowboys Infant Winning Streak T-Shirt - Navy,$12.99
NFL,dallas-cowboys,p-4110903,CeeDee Lamb Dallas Cowboys Newborn Mainline Player Name & Number Bodysuit - Navy,$23.99
NFL,dallas-cowboys,p-4556164,Dallas Cowboys Infant My First Tail Sweep Slouch Flex Hat - Navy/Gray,$19.99
NFL,dallas-cowboys,p-4396542,Dak Prescott Dallas Cowboys Newborn & Infant Mainliner Player Name & Number Bodysuit - Navy,$23.99
NFL,dallas-cowboys,p-4927652,Dallas Cowboys Newborn & Infant Born To Win Two-Pack Long Sleeve Bodysuit Set - Navy/Heathered Gray,$29.99
NFL,dallas-cowboys,p-4396541,Dak Prescott Dallas Cowboys Infant Mainliner Player Name & Number Bodysuit - Navy,$23.99
NFL,dallas-cowboys,p-4651616,Troy Aikman Dallas Cowboys Mitchell & Ness Newborn & Infant Retired Player Mainliner Name & Number Bodysuit - Heather Gray,$28.00
NFL,dallas-cowboys,p-4110901,CeeDee Lamb Dallas Cowboys Infant Mainliner Player Name & Number Bodysuit - Navy,$23.99
NFL,dallas-cowboys,p-4982153,Dallas Cowboys New Era Newborn & Infant Zoo 9FORTY Flex Hat - White,$23.99
NFL,dallas-cowboys,p-3532702,Dallas Cowboys Infant Christian Bodysuit - Navy,$12.99
NFL,dallas-cowboys,p-4651613,Troy Aikman Dallas Cowboys Mitchell & Ness Infant Mainliner Retired Player Name & Number Bodysuit - Heathered Gray,$27.99
NFL,dallas-cowboys,p-3449661,Dallas Cowboys For Bare Feet Infant Rugby Stripe Socks,$13.99
NFL,dallas-cowboys,p-2793207,Ezekiel Elliott Dallas Cowboys Newborn & Infant Player Name & Number Bodysuit - Navy,$9.99
NFL,dallas-cowboys,p-4564194,Trevon Diggs Dallas Cowboys Nike Infant Game Romper Jersey - Navy,$49.99
NFL,dallas-cowboys,p-4651241,Troy Aikman Dallas Cowboys Mitchell & Ness Infant 1996 Retired Legacy Jersey - Navy,$74.99
NFL,dallas-cowboys,p-4651240,Roger Staubach Dallas Cowboys Mitchell & Ness Infant 1971 Retired Legacy Jersey - Navy,$74.99
NFL,dallas-cowboys,p-4684696,Dallas Cowboys New Era Infant Mini Fan Beanie - Navy,$19.99
NFL,dallas-cowboys,p-4651615,Roger Staubach Dallas Cowboys Mitchell & Ness Newborn & Infant Retired Player Mainliner Name & Number Bodysuit - Heather Gray,$28.00
NFL,dallas-cowboys,p-4651614,Roger Staubach Dallas Cowboys Mitchell & Ness Infant Mainliner Retired Player Name & Number Bodysuit - Heathered Gray,$27.99
NFL,dallas-cowboys,p-3590917,Dallas Cowboys Infant Holiday Bodysuit Pajamas - Navy/Silver,$20.99
NFL,denver-broncos,p-3143064,"Denver Broncos Newborn & Infant Eat, Sleep, Drool Football Three-Piece Bodysuit Set - Orange/Navy",$20.99
NFL,denver-broncos,p-4793070,Russell Wilson Denver Broncos Nike Infant Game Jersey - Orange,$49.99
NFL,denver-broncos,p-4777498,Denver Broncos Infant Winning Streak T-Shirt - Navy,$12.99
NFL,denver-broncos,p-4538156,"Denver Broncos Newborn & Infant Little Champ Three-Piece Bodysuit, Bib & Booties Set - Orange/Navy",$29.99
NFL,denver-broncos,p-4683059,Denver Broncos New Era Infant Mini Fan Beanie - Orange,$19.99
NFL,denver-broncos,p-4556169,Denver Broncos Infant My First Tail Sweep Slouch Flex Hat - Orange/Navy,$19.99
NFL,denver-broncos,p-4981882,Denver Broncos Infant Tailgate Tutu Game Day Costume Set - Orange/White,$34.99
NFL,denver-broncos,p-1324611,Denver Broncos Newborn Full Zip Raglan Coverall - Orange,$24.99
NFL,denver-broncos,p-5340080,Denver Broncos Newborn & Infant Two-Pack Double Up Bodysuit Set - Orange/Gray,$25.99
NFL,denver-broncos,p-2069412,Denver Broncos Newborn & Infant Team Logo Bodysuit - Navy,$19.99
NFL,denver-broncos,p-4539025,"Denver Broncos Girls Newborn & Infant All The Love Bodysuit, Bib & Booties Set - Orange/Heathered Gray",$29.99
NFL,denver-broncos,p-1345460,Denver Broncos Infant Team Logo T-Shirt - Orange,$15.99
NFL,denver-broncos,p-4430698,"Newborn & Infant Orange Denver Broncos Bodysuit, Booties, Hat & Pants Set",$26.99
NFL,denver-broncos,p-5015516,Newborn & Infant Orange/Navy/Heather Gray Denver Broncos Three-Pack Team Wordmark Bodysuit Set,$27.99
NFL,denver-broncos,p-4430791,Newborn & Infant Orange/Navy/Heathered Gray Denver Broncos Three-Piece Bodysuit Set,$26.99
NFL,denver-broncos,p-1324758,Denver Broncos Infant Piped Raglan Full Zip Coverall - Orange,$24.99
NFL,denver-broncos,p-4478476,Girls Newborn & Infant Navy/Orange/White Denver Broncos Three-Piece Bodysuit Set,$26.99
NFL,denver-broncos,p-4478436,Newborn & Infant Navy Denver Broncos Sherpa Full-Zip Sleeper,$29.99
NFL,denver-broncos,p-4539056,Denver Broncos Newborn & Infant Too Much Love Two-Piece Bodysuit Set - Orange/Navy,$29.99
NFL,denver-broncos,p-5015536,Newborn & Infant Denver Broncos Cream Logo Hoodie Full-Zip Sleeper,$30.00
NFL,denver-broncos,p-5016143,Russell Wilson Denver Broncos Newborn & Infant Team Player Bodysuit - Orange,$22.99
NFL,denver-broncos,p-4819024,Russell Wilson Denver Broncos Newborn & Infant Mainliner Player Name & Number Bodysuit - Orange,$23.99
NFL,denver-broncos,p-5103353,Russell Wilson Denver Broncos Infant Mainliner Name & Number T-Shirt - Orange,$19.99
NFL,denver-broncos,p-3964699,Phillip Lindsay Denver Broncos Newborn & Infant Name & Number Three-Pack Bodysuit Set - Orange/Navy/Heathered Gray,$34.99
NFL,denver-broncos,p-4885675,Denver Broncos Newborn & Infant Disney Lil Champ Bodysuit - Orange,$21.99
NFL,denver-broncos,p-1346706,Denver Broncos Newborn & Infant Team Logo Bodysuit - Orange,$19.99
NFL,denver-broncos,p-4430734,"Girls Infant White/Orange Denver Broncos Bodysuit, Bib & Booties Set",$26.99
NFL,denver-broncos,p-4537893,"Denver Broncos Dream Team Newborn & Infant Bodysuit, Pants & Hat Set - White/Orange",$29.99
NFL,denver-broncos,p-4819010,Russell Wilson Denver Broncos Infant Mainliner Player Name & Number Bodysuit - Orange,$23.99
NFL,denver-broncos,p-3889514,Denver Broncos '47 Infant Bam Bam Cuffed Knit Hat With Pom and Mittens Set - Navy/Orange,$29.99
NFL,denver-broncos,p-4542260,Denver Broncos Infant 3-Pack Game On Bodysuit Set - Orange/Navy/Heathered Gray,$29.99
NFL,denver-broncos,p-3419275,Denver Broncos New Era Newborn & Infant Mini Fan Knit Beanie - Orange,$9.99
NFL,denver-broncos,p-4432212,Denver Broncos Infant Long Sleeve T-Shirt - Navy,$11.99
NFL,detroit-lions,p-3143075,"Detroit Lions Newborn & Infant Eat, Sleep, Drool Football Three-Piece Bodysuit Set - Blue/Black",$29.99
NFL,detroit-lions,p-4471547,Barry Sanders Detroit Lions Mitchell & Ness Infant 1996 Retired Legacy Jersey - Blue,$74.99
NFL,detroit-lions,p-4762026,Detroit Lions Infant Winning Streak T-Shirt - Black,$12.99
NFL,detroit-lions,p-5016144,Amon-Ra St. Brown Detroit Lions Newborn & Infant Team Player Bodysuit - Blue,$22.99
NFL,detroit-lions,p-4784331,Barry Sanders Detroit Lions Mitchell & Ness Infant Mainliner Retired Player Name & Number Bodysuit - Blue,$27.99
NFL,detroit-lions,p-4784333,Barry Sanders Detroit Lions Mitchell & Ness Newborn & Infant Retro Name & Number Bodysuit - Blue,$27.99
NFL,detroit-lions,p-1345470,Detroit Lions Infant Team Logo T-Shirt - Light Blue,$15.99
NFL,detroit-lions,p-4294776,Infant Blue Detroit Lions Football T-Shirt,$10.99
NFL,detroit-lions,p-4538135,Detroit Lions Newborn & Infant Born To Win Two-Pack Long Sleeve Bodysuit Set - Blue/Heathered Gray,$29.99
NFL,detroit-lions,p-5340087,Detroit Lions Newborn & Infant Two-Pack Double Up Bodysuit Set - Blue/Gray,$25.99
NFL,detroit-lions,p-4539068,Detroit Lions Newborn & Infant Too Much Love Two-Piece Bodysuit Set - Blue/Gray,$29.99
NFL,detroit-lions,p-4478460,Newborn & Infant Blue/Gray/Heathered Gray Detroit Lions Three-Piece Bodysuit Set,$26.99
NFL,detroit-lions,p-2262221,Detroit Lions Newborn Team Logo Bodysuit - Black,$19.99
NFL,detroit-lions,p-4539037,"Detroit Lions Girls Newborn & Infant All The Love Bodysuit, Bib & Booties Set - Blue/Heathered Gray",$29.99
NFL,detroit-lions,p-5015523,Newborn & Infant Blue/Silver/Heather Gray Detroit Lions Three-Pack Team Wordmark Bodysuit Set,$27.99
NFL,detroit-lions,p-2863059,Detroit Lions Newborn & Infant Bodysuit - Blue,$19.99
NFL,detroit-lions,p-5015543,Newborn & Infant Detroit Lions Cream Logo Hoodie Full-Zip Sleeper,$30.00
NFL,detroit-lions,p-4885714,Detroit Lions Newborn Star Wars Stay On Target Bodysuit - Blue,$21.99
NFL,detroit-lions,p-200087928,Aidan Hutchinson Detroit Lions Infant Mainliner Player Name & Number Bodysuit - Blue,$23.99
NFL,detroit-lions,p-3994544,Detroit Lions Infant Touchdown Raglan Long Sleeve Bodysuit & Pants Set - Heathered Gray/Blue,$34.99
NFL,detroit-lions,p-200087948,Aidan Hutchinson Detroit Lions Newborn & Infant Mainliner Player Name & Number Bodysuit - Blue,$23.99
NFL,detroit-lions,p-2899427,Detroit Lions WinCraft Lil Fan All Pro Baby Bib,$7.49
NFL,green-bay-packers,p-3143078,"Green Bay Packers Newborn & Infant Eat, Sleep, Drool Football Three-Piece Bodysuit Set - Green/Gold",$20.99
NFL,green-bay-packers,p-3889515,Green Bay Packers '47 Infant Bam Bam Cuffed Knit Hat With Pom and Mittens Set - Green/Gold,$29.99
NFL,green-bay-packers,p-4762030,Green Bay Packers Infant Winning Streak T-Shirt - Green,$12.99
NFL,green-bay-packers,p-1324624,Green Bay Packers Newborn Full Zip Raglan Coverall - Green,$24.99
NFL,green-bay-packers,p-4556179,Green Bay Packers Infant My First Tail Sweep Slouch Flex Hat - Green/Gold,$19.99
NFL,green-bay-packers,p-4542313,Green Bay Packers Girls Newborn & Infant Cutest Fan Bodysuit - Pink,$19.99
NFL,green-bay-packers,p-4538170,"Green Bay Packers Newborn & Infant Little Champ Three-Piece Bodysuit, Bib & Booties Set - Green/Gold",$29.99
NFL,green-bay-packers,p-4981883,Green Bay Packers Infant Tailgate Tutu Game Day Costume Set - Green/White,$34.99
NFL,green-bay-packers,p-4542276,Green Bay Packers Infant 3-Pack Game On Bodysuit Set - Green/Gold/Heathered Gray,$29.99
NFL,green-bay-packers,p-5340088,Green Bay Packers Newborn & Infant Two-Pack Double Up Bodysuit Set - Green/Gray,$25.99
NFL,green-bay-packers,p-4539072,Green Bay Packers Newborn & Infant Too Much Love Two-Piece Bodysuit Set - Green/Gold,$29.99
NFL,green-bay-packers,p-4539391,Green Bay Packers Newborn & Infant Little Fan Bodysuit - Heathered Gray,$19.99
NFL,green-bay-packers,p-1345471,Green Bay Packers Infant Team Logo T-Shirt - Green,$15.99
NFL,green-bay-packers,p-1346719,Green Bay Packers Newborn & Infant Team Logo Bodysuit - Green,$19.99
NFL,green-bay-packers,p-5015545,Newborn & Infant Green Bay Packers Cream Logo Hoodie Full-Zip Sleeper,$30.00
NFL,green-bay-packers,p-4478509,Girls Newborn & Infant Green/Gold Green Bay Packers Two-Piece Cheerleader Set with Bloomers,$24.97
NFL,green-bay-packers,p-3143281,Green Bay Packers Girls Newborn Homecoming Two-Pack Bodysuit- Green/Gold,$19.99
NFL,green-bay-packers,p-3497152,Green Bay Packers Girls Infant Homecoming Celebration 2-Piece Bodysuit Set - Green/Gold,$19.99
NFL,green-bay-packers,p-3143107,Green Bay Packers Girls Infant Cheer Captain Jumper Dress - Green/Gold,$31.99
NFL,green-bay-packers,p-4683067,Green Bay Packers New Era Infant Mini Fan Beanie - Green,$19.99
NFL,green-bay-packers,p-4539041,"Green Bay Packers Girls Newborn & Infant All The Love Bodysuit, Bib & Booties Set - Green/Heathered Gray",$29.99
NFL,green-bay-packers,p-5016145,Aaron Rodgers Green Bay Packers Newborn & Infant Team Player Bodysuit - Green,$22.99
NFL,green-bay-packers,p-3880201,Green Bay Packers Newborn & Infant Football Head Knit Hat - Brown,$21.99
NFL,green-bay-packers,p-4537909,"Green Bay Packers Dream Team Newborn & Infant Bodysuit, Pants & Hat Set - White/Green",$29.99
NFL,green-bay-packers,p-4538138,Green Bay Packers Newborn & Infant Born To Win Two-Pack Long Sleeve Bodysuit Set - Green/Heathered Gray,$29.99
NFL,green-bay-packers,p-3457326,Green Bay Packers Infant My First II Flex Hat - Green,$10.99
NFL,green-bay-packers,p-4260784,Green Bay Packers Newborn & Infant Slouch Flex Hat - Green,$19.99
NFL,green-bay-packers,p-4539010,Green Bay Packers Girls Infant Heart to Heart Jersey Tri-Blend Dress - Green/Gold,$29.99
NFL,green-bay-packers,p-1324770,Green Bay Packers Infant Piped Raglan Full Zip Coverall - Green,$24.99
NFL,houston-texans,p-4294784,Infant Navy Houston Texans Football T-Shirt,$4.99
NFL,houston-texans,p-4347703,Houston Texans Newborn & Infant 3rd Down & Goal Three-Piece Bodysuit Set - Navy/Red/Heathered Gray,$29.99
NFL,houston-texans,p-5015551,Newborn & Infant Houston Texans Cream Logo Hoodie Full-Zip Sleeper,$30.00
NFL,houston-texans,p-5071860,Davis Mills Houston Texans Newborn & Infant Team Player Bodysuit - Navy,$22.99
NFL,houston-texans,p-4539367,Houston Texans Infant Hand-Off T-Shirt - Navy,$15.99
NFL,houston-texans,p-3587056,"Houston Texans Newborn & Infant Greatest Lil Player Bodysuit, Pants & Knit Hat Set - Navy",$27.99
NFL,houston-texans,p-4332421,Houston Texans Infant Littlest Fan T-Shirt - Navy,$14.99
NFL,houston-texans,p-4539079,Houston Texans Newborn & Infant Too Much Love Two-Piece Bodysuit Set - Navy/Red,$29.99
NFL,houston-texans,p-4538178,"Houston Texans Newborn & Infant Little Champ Three-Piece Bodysuit, Bib & Booties Set - Navy/Red",$29.99
NFL,houston-texans,p-4354210,Houston Texans Newborn & Infant Game Nap Fleece Full-Zip Sleeper - Navy,$34.99
NFL,houston-texans,p-3961130,Houston Texans Infant Champ 3-Pack Bodysuit Set - Navy/Red/Heathered Gray,$29.99
NFL,houston-texans,p-3972124,"Houston Texans Newborn & Infant Tackle Bodysuit, Bib & Booties Set - Navy",$22.99
NFL,houston-texans,p-4542283,Houston Texans Infant 3-Pack Game On Bodysuit Set - Navy/Red/Heathered Gray,$29.99
NFL,houston-texans,p-3972094,Houston Texans Girls Newborn Two-Pack Touchdown Bodysuit Set - Red/Navy,$29.99
NFL,houston-texans,p-4537978,Houston Texans Newborn & Infant Game Nap Teddy Fleece Bunting Full-Zip Sleeper - Navy/Gray,$39.99
NFL,houston-texans,p-1324634,Houston Texans Newborn Full Zip Raglan Coverall - Navy Blue,$24.99
NFL,houston-texans,p-4445970,Houston Texans Newborn & Infant 2-Pack Little Player Long Sleeve Bodysuit Set - Red/Navy,$29.99
NFL,houston-texans,p-4538114,Houston Texans Infant Little Kicker Long Sleeve Bodysuit & Pants Set - Navy/Red,$29.99
NFL,houston-texans,p-3962240,"Houston Texans Newborn & Infant Ready, Set, Nap Three-Pack Bodysuit Set - Navy/Red/Heathered Gray",$26.99
NFL,houston-texans,p-2499360,Houston Texans WinCraft Infant Lil Fan All Pro Baby Bib,$7.49
NFL,houston-texans,p-3962305,Houston Texans Newborn Football Bodysuit - Brown,$14.99
NFL,houston-texans,p-3972064,"Houston Texans Newborn & Infant Play Your Best Bodysuit, Bib & Booties Set - Navy",$29.99
NFL,houston-texans,p-4222707,Houston Texans New Era Newborn & Infant My 1st 9TWENTY Flex Hat - Navy,$19.99
NFL,houston-texans,p-3174079,Newborn & Infant Navy Houston Texans Mesh Jersey T-Shirt,$9.99
NFL,houston-texans,p-4478454,Newborn & Infant Navy Houston Texans Sherpa Full-Zip Sleeper,$29.99
NFL,houston-texans,p-4478515,Girls Newborn & Infant Navy/Red Houston Texans Two-Piece Cheerleader Set with Bloomers,$24.97
NFL,houston-texans,p-4478464,Newborn & Infant Navy/Red/Heathered Gray Houston Texans Three-Piece Bodysuit Set,$26.99
NFL,houston-texans,p-5015328,Newborn & Infant Navy Houston Texans Allover Print Full-Zip Footed Jumper,$18.00
NFL,houston-texans,p-3143087,"Houston Texans Newborn & Infant Eat, Sleep, Drool Football Three-Piece Bodysuit Set - Navy/Red",$29.99
NFL,houston-texans,p-4762037,Houston Texans Infant Winning Streak T-Shirt - Navy,$12.99
NFL,houston-texans,p-3960559,Houston Texans Newborn & Infant Field 2-Pack Bodysuit Set - Navy/Green,$17.99
NFL,houston-texans,p-4753163,Houston Texans WinCraft Newborn & Infant Rainbow Baby Bib,$8.24
NFL,houston-texans,p-3592345,Houston Texans WinCraft Infant Drool All-Pro Bib,$8.99
NFL,houston-texans,p-3237098,Deshaun Watson Houston Texans Nike Infant Romper Jersey - Navy,$17.99
NFL,houston-texans,p-4432210,Infant Gray Houston Texans Football Long Sleeve T-Shirt,$11.99
NFL,houston-texans,p-4537916,"Houston Texans Dream Team Newborn & Infant Bodysuit, Pants & Hat Set - White/Navy",$29.99
NFL,houston-texans,p-1324779,Houston Texans Infant Piped Raglan Full Zip Coverall - Navy Blue,$24.99
NFL,houston-texans,p-3994555,Houston Texans Infant Touchdown Raglan Long Sleeve Bodysuit & Pants Set - Red/Navy,$34.99
NFL,houston-texans,p-5015531,Newborn & Infant Navy/Red/Heather Gray Houston Texans Three-Pack Team Wordmark Bodysuit Set,$27.99
NFL,houston-texans,p-4451626,Houston Texans Infant Football Bodysuit - Brown,$14.99
NFL,houston-texans,p-3592389,Houston Texans WinCraft Newborn & Infant Eat. Drink. Repeat. All-Pro Bib,$8.99
NFL,indianapolis-colts,p-4471548,Peyton Manning Indianapolis Colts Mitchell & Ness Infant 1998 Retired Legacy Jersey - Royal,$74.99
NFL,indianapolis-colts,p-3143068,"Indianapolis Colts Newborn & Infant Eat, Sleep, Drool Football Three-Piece Bodysuit Set - Royal/White",$29.99
NFL,indianapolis-colts,p-4762022,Indianapolis Colts Infant Winning Streak T-Shirt - Heathered Gray,$12.99
NFL,indianapolis-colts,p-4449044,Jonathan Taylor Indianapolis Colts Infant Mainliner Player Name & Number Bodysuit - Royal,$23.99
NFL,indianapolis-colts,p-1345464,Indianapolis Colts Infant Team Logo T-Shirt - Royal,$15.99
