Sport,Team,Product ID,Product Name,Product Price
NFL,arizona-cardinals,p-3546156,Kyler Murray Arizona Cardinals Nike Infant Game Jersey - Cardinal,$19.99
NFL,arizona-cardinals,p-4537951,Arizona Cardinals Newborn & Infant Game Nap Teddy Fleece Bunting Full-Zip Sleeper - Cardinal,$39.99
NFL,arizona-cardinals,p-3143060,"Arizona Cardinals Newborn & Infant Eat, Sleep, Drool Football Three-Piece Bodysuit Set - Cardinal/Black",$29.99
NFL,arizona-cardinals,p-1346702,Arizona Cardinals Newborn & Infant Team Logo Bodysuit - Cardinal,$19.99
NFL,arizona-cardinals,p-4478471,"Girls Infant Cardinal Arizona Cardinals Bib, Booties & Bodysuit Set",$26.99
NFL,arizona-cardinals,p-5015309,Newborn & Infant Cardinal Arizona Cardinals Allover Print Full-Zip Footed Jumper,$18.00
NFL,arizona-cardinals,p-4981875,Arizona Cardinals Infant Tailgate Tutu Game Day Costume Set - Cardinal/White,$34.99
NFL,arizona-cardinals,p-4478432,Newborn & Infant Red Arizona Cardinals Sherpa Full-Zip Sleeper,$29.99
NFL,arizona-cardinals,p-4539052,Arizona Cardinals Newborn & Infant Too Much Love Two-Piece Bodysuit Set - Cardinal/Black,$29.99
NFL,arizona-cardinals,p-5016137,DeAndre Hopkins Arizona Cardinals Newborn & Infant Team Player Bodysuit - Cardinal,$9.99
NFL,arizona-cardinals,p-3143091,Arizona Cardinals Girls Infant Cheer Captain Jumper Dress - Cardinal/Black,$31.99
NFL,arizona-cardinals,p-4539021,"Arizona Cardinals Girls Newborn & Infant All The Love Bodysuit, Bib & Booties Set - Cardinal/Heathered Gray",$29.99
NFL,arizona-cardinals,p-4538119,Arizona Cardinals Newborn & Infant Born To Win Two-Pack Long Sleeve Bodysuit Set - Cardinal/Heathered Gray,$29.99
NFL,arizona-cardinals,p-4294768,Infant Black Arizona Cardinals Football T-Shirt,$10.99
NFL,arizona-cardinals,p-4762014,Arizona Cardinals Infant Winning Streak T-Shirt - Heathered Gray,$12.99
NFL,arizona-cardinals,p-4885703,Arizona Cardinals Newborn Star Wars Stay On Target Bodysuit - Cardinal,$21.99
NFL,arizona-cardinals,p-4554384,Arizona Cardinals Infant Slouch Flex Hat - Cardinal,$19.99
NFL,arizona-cardinals,p-3965441,Kyler Murray Arizona Cardinals Infant Mainliner Player Name & Number Bodysuit - Cardinal,$23.99
NFL,arizona-cardinals,p-3730430,Kyler Murray Arizona Cardinals Infant Mainliner Name & Number Bodysuit - Black,$23.99
NFL,arizona-cardinals,p-3592351,Arizona Cardinals WinCraft Infant Drool All-Pro Bib,$7.49
NFL,arizona-cardinals,p-3592378,Arizona Cardinals WinCraft Newborn & Infant Eat. Drink. Repeat. All-Pro Bib,$7.49
NFL,arizona-cardinals,p-4683064,Arizona Cardinals New Era Infant Mini Fan Beanie - Cardinal,$19.99
NFL,arizona-cardinals,p-2068739,Arizona Cardinals Infant Team Logo T-Shirt - Cardinal,$15.99
NFL,arizona-cardinals,p-4538152,"Arizona Cardinals Newborn & Infant Little Champ Three-Piece Bodysuit, Bib & Booties Set - Cardinal/Black",$29.99
NFL,arizona-cardinals,p-5015533,Newborn & Infant Arizona Cardinals Cream Logo Hoodie Full-Zip Sleeper,$30.00
NFL,arizona-cardinals,p-3497103,"Arizona Cardinals Girls Newborn MVP Bodysuit, Bib & Booties Set - Cardinal",$20.99
NFL,arizona-cardinals,p-3162610,Larry Fitzgerald Arizona Cardinals Newborn Mainliner Name & Number Bodysuit - Cardinal,$14.99
NFL,arizona-cardinals,p-200038893,Kyler Murray Arizona Cardinals Nike Newborn & Infant Romper Jersey - Cardinal,$49.99
NFL,arizona-cardinals,p-4556166,Arizona Cardinals Infant My First Tail Sweep Slouch Flex Hat - Cardinal/Black,$19.99
NFL,arizona-cardinals,p-3965109,Kyler Murray Arizona Cardinals Newborn & Infant Mainliner Name & Number Bodysuit - Cardinal,$23.99
NFL,arizona-cardinals,p-4260584,Kyler Murray Arizona Cardinals Newborn & Infant Three-Pack Name & Number Bodysuit Set - Cardinal/Black/Heathered Gray,$34.99
NFL,arizona-cardinals,p-4538088,Arizona Cardinals Infant Little Kicker Long Sleeve Bodysuit & Pants Set - Cardinal/Black,$29.99
NFL,arizona-cardinals,p-4554762,Arizona Cardinals Newborn & Infant Football Head Knit Hat with Pom - Brown,$21.99
NFL,arizona-cardinals,p-2831236,Arizona Cardinals Infant Piped Raglan Full-Zip Sleeper - Cardinal,$24.99
NFL,arizona-cardinals,p-1324607,Arizona Cardinals Newborn Full Zip Raglan Coverall - Cardinal,$24.99
NFL,arizona-cardinals,p-4347677,Arizona Cardinals Newborn & Infant 3rd Down & Goal Three-Piece Bodysuit Set - Cardinal/Black/Heathered Gray,$29.99
NFL,arizona-cardinals,p-4478499,Girls Newborn & Infant Cardinal/Black Arizona Cardinals Two-Piece Cheerleader Set with Bloomers,$24.97
NFL,arizona-cardinals,p-4542256,Arizona Cardinals Infant 3-Pack Game On Bodysuit Set - Cardinal/Black/Heathered Gray,$29.99
NFL,arizona-cardinals,p-2135247,Patrick Peterson Arizona Cardinals Nike Infant Team Color Game Jersey - Cardinal,$17.99
NFL,arizona-cardinals,p-4437641,Kyler Murray Arizona Cardinals Nike Newborn & Infant Game Romper Jersey - Cardinal,$19.99
NFL,arizona-cardinals,p-4537982,Arizona Cardinals Girls Newborn & Infant Spreading Love Bodysuit and Tutu Leggings Set - White,$29.99
NFL,arizona-cardinals,p-200038884,Kyler Murray Arizona Cardinals Nike Infant Game Jersey - Cardinal,$49.99
NFL,arizona-cardinals,p-4538990,Arizona Cardinals Girls Infant Heart to Heart Jersey Tri-Blend Dress - Cardinal/Black,$29.99
NFL,arizona-cardinals,p-4537889,"Arizona Cardinals Dream Team Newborn & Infant Bodysuit, Pants & Hat Set - White/Cardinal",$29.99
NFL,arizona-cardinals,p-5015513,Newborn & Infant Cardinal/Black/Heather Gray Arizona Cardinals Three-Pack Team Wordmark Bodysuit Set,$27.99
NFL,arizona-cardinals,p-5340076,Arizona Cardinals Newborn & Infant Two-Pack Double Up Bodysuit Set - Cardinal/Gray,$25.99
NFL,arizona-cardinals,p-4478455,Infant Black/Cardinal/Heathered Gray Arizona Cardinals Three-Pack Bodysuit Set,$26.99
NFL,arizona-cardinals,p-4753136,Arizona Cardinals WinCraft Newborn & Infant Rainbow Baby Bib,$8.24
NFL,atlanta-falcons,p-4777499,Atlanta Falcons Infant Winning Streak T-Shirt - Black,$12.99
NFL,atlanta-falcons,p-3143071,"Atlanta Falcons Newborn & Infant Eat, Sleep, Drool Football Three-Piece Bodysuit Set - Red/Black",$29.99
NFL,atlanta-falcons,p-5016138,Kyle Pitts Atlanta Falcons Newborn & Infant Team Player Bodysuit - Red,$22.99
NFL,atlanta-falcons,p-3172616,Girls Newborn & Infant Red/White Atlanta Falcons 2-Pack Long Sleeve Bodysuits,$9.99
NFL,atlanta-falcons,p-2499313,Atlanta Falcons WinCraft Infant Lil Fan All Pro Baby Bib,$7.49
NFL,atlanta-falcons,p-4539066,Atlanta Falcons Newborn & Infant Too Much Love Two-Piece Bodysuit Set - Red/Black,$29.99
NFL,atlanta-falcons,p-3174098,Newborn & Infant White/Red Atlanta Falcons Long Sleeve Pants Set,$13.99
NFL,atlanta-falcons,p-1346714,Atlanta Falcons Newborn & Infant Team Logo Bodysuit - Red,$19.99
NFL,atlanta-falcons,p-3174065,Newborn & Infant Black Atlanta Falcons Mesh Jersey T-Shirt,$7.99
NFL,atlanta-falcons,p-3171999,Newborn & Infant Red/Black Atlanta Falcons 2-Pack Long Sleeve Bodysuits,$12.99
NFL,atlanta-falcons,p-3172014,Newborn & Infant Red/Black/Gray Atlanta Falcons Rookie 3-Pack Bodysuit Set,$13.99
NFL,atlanta-falcons,p-4478443,Newborn & Infant Red Atlanta Falcons Sherpa Full-Zip Sleeper,$29.99
NFL,atlanta-falcons,p-5015542,Newborn & Infant Atlanta Falcons Cream Logo Hoodie Full-Zip Sleeper,$30.00
NFL,atlanta-falcons,p-5015318,Newborn & Infant Red Atlanta Falcons Allover Print Full-Zip Footed Jumper,$18.00
NFL,atlanta-falcons,p-1345467,Atlanta Falcons Infant Team Logo T-Shirt - Red,$15.99
NFL,atlanta-falcons,p-3174137,Infant Heathered Gray Atlanta Falcons Crew Neck T-Shirt,$4.99
NFL,atlanta-falcons,p-4784332,Deion Sanders Atlanta Falcons Mitchell & Ness Newborn & Infant Retro Name & Number Bodysuit - Black,$27.99
NFL,atlanta-falcons,p-3994543,Atlanta Falcons Infant Touchdown Raglan Long Sleeve Bodysuit & Pants Set - Red/Black,$34.99
NFL,atlanta-falcons,p-3961116,Atlanta Falcons Infant Champ 3-Pack Bodysuit Set - Red/Black/Heathered Gray,$29.99
NFL,atlanta-falcons,p-4354198,Atlanta Falcons Newborn & Infant Game Nap Fleece Full-Zip Sleeper - Black,$34.99
NFL,atlanta-falcons,p-4753148,Atlanta Falcons WinCraft Newborn & Infant Rainbow Baby Bib,$8.24
NFL,atlanta-falcons,p-4059601,Atlanta Falcons Infant Hello Mascot Bodysuit - Red,$14.99
NFL,atlanta-falcons,p-4538163,"Atlanta Falcons Newborn & Infant Little Champ Three-Piece Bodysuit, Bib & Booties Set - Red/Black",$29.99
NFL,atlanta-falcons,p-4885713,Atlanta Falcons Newborn Star Wars Stay On Target Bodysuit - Red,$21.99
NFL,atlanta-falcons,p-5015522,Newborn & Infant Red/Black/Heather Gray Atlanta Falcons Three-Pack Team Wordmark Bodysuit Set,$27.99
NFL,atlanta-falcons,p-4538099,Atlanta Falcons Infant Little Kicker Long Sleeve Bodysuit & Pants Set - Red/Black,$29.99
NFL,atlanta-falcons,p-3538898,Newborn & Infant Black/Red/Gray Atlanta Falcons Team 3-Pack Bodysuit Set,$10.99
NFL,atlanta-falcons,p-3174087,Newborn & Infant Red Atlanta Falcons Receiver T-Shirt,$4.99
NFL,atlanta-falcons,p-4683071,Atlanta Falcons New Era Infant Mini Fan Beanie - Black,$19.99
NFL,atlanta-falcons,p-3975755,Atlanta Falcons Newborn & Infant Little Player Long Sleeve 2-Pack Bodysuit Set - Black/Red,$29.99
NFL,atlanta-falcons,p-4430794,Newborn & Infant Black/Red/Heathered Gray Atlanta Falcons Three-Piece Bodysuit Set,$26.99
NFL,atlanta-falcons,p-4003465,Atlanta Falcons Infant Raglan Full-Zip Sleeper - Red,$24.99
NFL,atlanta-falcons,p-4542270,Atlanta Falcons Infant 3-Pack Game On Bodysuit Set - Red/Black/Heathered Gray,$29.99
NFL,atlanta-falcons,p-788693,Julio Jones Atlanta Falcons Nike Infant Team Color Game Jersey - Red,$21.99
NFL,baltimore-ravens,p-3548346,Lamar Jackson Baltimore Ravens Nike Infant Game Jersey - Purple,$49.99
NFL,baltimore-ravens,p-3993688,Lamar Jackson Baltimore Ravens Nike Newborn & Infant Romper Jersey - Purple,$49.99
NFL,baltimore-ravens,p-3143082,"Baltimore Ravens Newborn & Infant Eat, Sleep, Drool Football Three-Piece Bodysuit Set - Purple/Black",$29.99
NFL,baltimore-ravens,p-4762033,Baltimore Ravens Infant Winning Streak T-Shirt - Black,$12.99
NFL,baltimore-ravens,p-3730439,Lamar Jackson Baltimore Ravens Infant Mainliner Name & Number Bodysuit - Black,$23.99
NFL,baltimore-ravens,p-4539075,Baltimore Ravens Newborn & Infant Too Much Love Two-Piece Bodysuit Set - Purple/Black,$29.99
NFL,baltimore-ravens,p-3889510,Baltimore Ravens '47 Infant Bam Bam Cuffed Knit Hat With Pom and Mittens Set - Purple/Black,$29.99
NFL,baltimore-ravens,p-1346724,Baltimore Ravens Newborn & Infant Team Logo Bodysuit - Purple,$19.99
NFL,baltimore-ravens,p-1345474,Baltimore Ravens Infant Team Logo T-Shirt - Purple,$15.99
NFL,baltimore-ravens,p-4538174,"Baltimore Ravens Newborn & Infant Little Champ Three-Piece Bodysuit, Bib & Booties Set - Purple/Black",$29.99
NFL,baltimore-ravens,p-3730440,Lamar Jackson Baltimore Ravens Infant Mainliner Name & Number Bodysuit - Purple,$23.99
NFL,baltimore-ravens,p-3730420,Lamar Jackson Baltimore Ravens Newborn Mainliner Name & Number Bodysuit - Purple,$23.99
NFL,baltimore-ravens,p-4478463,Newborn & Infant Purple/Black/Heathered Gray Baltimore Ravens Three-Piece Bodysuit Set,$26.99
NFL,baltimore-ravens,p-4981876,Baltimore Ravens Infant Tailgate Tutu Game Day Costume Set - Purple,$34.99
NFL,baltimore-ravens,p-4478474,"Girls Infant Purple Baltimore Ravens Bib, Booties & Bodysuit Set",$26.99
NFL,baltimore-ravens,p-4538005,Baltimore Ravens Girls Newborn & Infant Spreading Love Bodysuit and Tutu Leggings Set - White,$29.99
NFL,baltimore-ravens,p-4478450,Newborn & Infant Purple Baltimore Ravens Sherpa Full-Zip Sleeper,$29.99
NFL,baltimore-ravens,p-4542279,Baltimore Ravens Infant 3-Pack Game On Bodysuit Set - Purple/Black/Heathered Gray,$29.99
NFL,baltimore-ravens,p-5015547,Newborn & Infant Baltimore Ravens Cream Logo Hoodie Full-Zip Sleeper,$30.00
NFL,baltimore-ravens,p-1324774,Baltimore Ravens Infant Piped Raglan Full Zip Coverall - Purple,$24.99
NFL,baltimore-ravens,p-5015527,Infant Purple/Black/Heather Gray Baltimore Ravens Three-Pack Team Wordmark Bodysuit Set,$27.99
NFL,baltimore-ravens,p-4683072,Baltimore Ravens New Era Infant Mini Fan Beanie -  Black,$19.99
NFL,baltimore-ravens,p-4538110,Baltimore Ravens Infant Little Kicker Long Sleeve Bodysuit & Pants Set - Purple/Black,$29.99
NFL,baltimore-ravens,p-3730419,Lamar Jackson Baltimore Ravens Newborn Mainliner Name & Number Bodysuit - Black,$23.99
NFL,baltimore-ravens,p-4539044,"Baltimore Ravens Girls Newborn & Infant All The Love Bodysuit, Bib & Booties Set - Purple/Heathered Gray",$29.99
NFL,baltimore-ravens,p-4885695,Baltimore Ravens Newborn & Infant Disney Lil Champ Bodysuit - Purple,$21.99
NFL,baltimore-ravens,p-4064579,Baltimore Ravens Girls Infant Too Cute Long Sleeve Bodysuit & Pants Set - Red,$19.99
NFL,baltimore-ravens,p-3968990,Baltimore Ravens Girls Infant Cheer Captain Jumper Dress - Purple,$31.99
NFL,baltimore-ravens,p-4539363,Baltimore Ravens Infant Hand-Off T-Shirt - Purple,$15.99
NFL,baltimore-ravens,p-4538142,Baltimore Ravens Newborn & Infant Born To Win Two-Pack Long Sleeve Bodysuit Set - Purple/Heathered Gray,$29.99
NFL,baltimore-ravens,p-4537974,Baltimore Ravens Newborn & Infant Game Nap Teddy Fleece Bunting Full-Zip Sleeper - Purple/Gray,$39.99
NFL,buffalo-bills,p-3143063,"Buffalo Bills Newborn & Infant Eat, Sleep, Drool Football Three-Piece Bodysuit Set - Royal/Red",$29.99
NFL,buffalo-bills,p-3998160,Josh Allen Buffalo Bills Nike Newborn & Infant Romper Jersey - Royal,$49.99
NFL,buffalo-bills,p-1324610,Buffalo Bills Newborn Full Zip Raglan Coverall - Royal Blue,$24.99
NFL,buffalo-bills,p-4490764,Buffalo Bills Newborn & Infant Victory Formation Throwback Three-Piece Bodysuit and Knit Hat Set - Red/Royal,$33.74
NFL,buffalo-bills,p-4556168,Buffalo Bills Infant My First Tail Sweep Slouch Flex Hat - Royal/Red,$19.99
NFL,buffalo-bills,p-2068740,Buffalo Bills Infant Team Logo T-Shirt - Royal,$15.99
NFL,buffalo-bills,p-4981877,Buffalo Bills Infant Tailgate Tutu Game Day Costume Set - Royal/White,$34.99
NFL,buffalo-bills,p-4539054,Buffalo Bills Newborn & Infant Too Much Love Two-Piece Bodysuit Set - Royal/Red,$29.99
NFL,buffalo-bills,p-3800732,Josh Allen Buffalo Bills Infant Mainliner Name & Number Bodysuit - Royal,$23.99
NFL,buffalo-bills,p-1324757,Buffalo Bills Infant Piped Raglan Full Zip Coverall - Royal Blue,$24.99
NFL,buffalo-bills,p-3470780,Josh Allen Buffalo Bills Newborn Mainliner Name & Number Bodysuit - Royal,$23.99
NFL,buffalo-bills,p-1346705,Buffalo Bills Newborn & Infant Team Logo Bodysuit - Royal,$19.99
NFL,buffalo-bills,p-4538992,Buffalo Bills Girls Infant Heart to Heart Jersey Tri-Blend Dress - Royal/Red,$29.99
NFL,buffalo-bills,p-4538155,"Buffalo Bills Newborn & Infant Little Champ Three-Piece Bodysuit, Bib & Booties Set - Royal/Red",$29.99
NFL,buffalo-bills,p-4539023,"Buffalo Bills Girls Newborn & Infant All The Love Bodysuit, Bib & Booties Set - Royal/Heathered Gray",$29.99
NFL,buffalo-bills,p-4683073,Buffalo Bills New Era Infant Mini Fan Beanie -  Royal,$19.99
NFL,buffalo-bills,p-4762016,Buffalo Bills Infant Winning Streak T-Shirt - Royal,$12.99
NFL,buffalo-bills,p-4953742,"Buffalo Bills Mitchell & Ness Newborn & Infant Throwback Bodysuit, Bib & Booties Set - Royal/Red",$44.99
NFL,buffalo-bills,p-4478475,Girls Newborn & Infant Royal/Red/White Buffalo Bills Three-Piece Bodysuit Set,$26.99
NFL,buffalo-bills,p-4478456,Newborn & Infant Royal/Red/Heathered Gray Buffalo Bills Three-Piece Bodysuit Set,$26.99
NFL,buffalo-bills,p-4449030,Stefon Diggs Buffalo Bills Newborn & Infant Mainliner Player Name & Number Bodysuit - Royal,$23.99
NFL,buffalo-bills,p-4542258,Buffalo Bills Infant 3-Pack Game On Bodysuit Set - Royal/Red/Heathered Gray,$29.99
NFL,buffalo-bills,p-4885673,Buffalo Bills Newborn & Infant Disney Lil Champ Bodysuit - Royal,$21.99
NFL,buffalo-bills,p-4478501,Girls Newborn & Infant Royal/Red Buffalo Bills Two-Piece Cheerleader Set with Bloomers,$24.97
NFL,buffalo-bills,p-4449042,Stefon Diggs Buffalo Bills Infant Mainliner Player Name & Number Bodysuit - Royal,$23.99
NFL,buffalo-bills,p-4537984,Buffalo Bills Girls Newborn & Infant Spreading Love Bodysuit and Tutu Leggings Set - White,$29.99
NFL,buffalo-bills,p-3143094,Buffalo Bills Girls Infant Cheer Captain Jumper Dress - Royal/Red,$31.99
NFL,buffalo-bills,p-2800517,Buffalo Bills New Era Infant My 1st 9FIFTY Adjustable Hat - Royal/Red,$15.99
NFL,buffalo-bills,p-4885705,Buffalo Bills Newborn Star Wars Stay On Target Bodysuit - Royal,$21.99
NFL,buffalo-bills,p-4538122,Buffalo Bills Newborn & Infant Born To Win Two-Pack Long Sleeve Bodysuit Set - Royal/Heathered Gray,$29.99
NFL,carolina-panthers,p-200038894,Jeremy Chinn Carolina Panthers Nike Newborn Romper Game Jersey - Black,$49.99
NFL,carolina-panthers,p-4347687,Carolina Panthers Newborn & Infant 3rd Down & Goal Three-Piece Bodysuit Set - Black/Blue/Heathered Gray,$29.99
NFL,carolina-panthers,p-4777501,Carolina Panthers Infant Winning Streak T-Shirt - Black,$12.99
NFL,carolina-panthers,p-4537961,Carolina Panthers Newborn & Infant Game Nap Teddy Fleece Bunting Full-Zip Sleeper - Black/Gray,$39.99
NFL,carolina-panthers,p-3143079,"Carolina Panthers Newborn & Infant Eat, Sleep, Drool Football Three-Piece Bodysuit Set - Black/Blue",$29.99
NFL,carolina-panthers,p-1346720,Carolina Panthers Newborn & Infant Team Logo Bodysuit - Black,$19.99
NFL,carolina-panthers,p-4478478,Girls Newborn & Infant Black/Blue/White Carolina Panthers Three-Piece Bodysuit Set,$26.99
NFL,carolina-panthers,p-4478473,"Girls Infant White/Black Carolina Panthers Bib, Booties & Bodysuit Set",$26.99
NFL,carolina-panthers,p-2499339,Carolina Panthers WinCraft Infant Lil Fan All Pro Baby Bib,$7.49
NFL,carolina-panthers,p-4538171,"Carolina Panthers Newborn & Infant Little Champ Three-Piece Bodysuit, Bib & Booties Set - Black/Blue",$29.99
NFL,carolina-panthers,p-5340083,Carolina Panthers Newborn & Infant Two-Pack Double Up Bodysuit Set - Black/Gray,$25.99
NFL,carolina-panthers,p-4478447,Newborn & Infant Black Carolina Panthers Sherpa Full-Zip Sleeper,$29.99
NFL,carolina-panthers,p-4537899,"Carolina Panthers Dream Team Newborn & Infant Bodysuit, Pants & Hat Set - White/Black",$29.99
NFL,carolina-panthers,p-2069410,Carolina Panthers Infant Team Logo T-Shirt - Black,$15.99
NFL,carolina-panthers,p-5015316,Newborn & Infant Black Carolina Panthers Allover Print Full-Zip Footed Jumper,$18.00
NFL,carolina-panthers,p-5015540,Newborn & Infant Carolina Panthers Cream Logo Hoodie Full-Zip Sleeper,$30.00
NFL,carolina-panthers,p-2560941,Carolina Panthers For Bare Feet Infant Team Color Rugby Block Socks - Black/Blue,$13.99
NFL,carolina-panthers,p-5015520,Newborn & Infant Black/Gray/Heather Gray Carolina Panthers Three-Pack Team Wordmark Bodysuit Set,$27.99
NFL,carolina-panthers,p-4538139,Carolina Panthers Newborn & Infant Born To Win Two-Pack Long Sleeve Bodysuit Set - Black/Heathered Gray,$29.99
NFL,carolina-panthers,p-3962262,Carolina Panthers Newborn and Infant Game Nap Fleece Sleeper - Charcoal,$34.99
NFL,carolina-panthers,p-4478462,Newborn & Infant Blue/Black/Heathered Gray Carolina Panthers Three-Piece Bodysuit Set,$26.99
NFL,carolina-panthers,p-1325005,Carolina Panthers Infant Piped Raglan Full Zip Sleeper - Black,$24.99
NFL,carolina-panthers,p-4163717,Carolina Panthers Newborn & Infant 2-Pack Pacifier Set,$12.99
NFL,carolina-panthers,p-4538107,Carolina Panthers Infant Little Kicker Long Sleeve Bodysuit & Pants Set - Black/Blue,$29.99
NFL,carolina-panthers,p-3162619,Christian McCaffrey Carolina Panthers Newborn Mainliner Name & Number Bodysuit - Black,$9.99
NFL,carolina-panthers,p-4753156,Carolina Panthers WinCraft Newborn & Infant Rainbow Baby Bib,$8.24
NFL,carolina-panthers,p-788712,Cam Newton Carolina Panthers Nike Infant Team Color Game Jersey - Black,$21.99
NFL,carolina-panthers,p-3994540,Carolina Panthers Infant Touchdown Raglan Long Sleeve Bodysuit & Pants Set - Blue/Black,$34.99
NFL,carolina-panthers,p-200038887,Jeremy Chinn Carolina Panthers Nike Infant Game Jersey - Black,$49.99
NFL,carolina-panthers,p-4539062,Carolina Panthers Newborn & Infant Too Much Love Two-Piece Bodysuit Set - Black/Blue,$29.99
NFL,carolina-panthers,p-4554768,Carolina Panthers Newborn & Infant Football Head Knit Hat with Pom - Brown,$21.99
NFL,carolina-panthers,p-4542266,Carolina Panthers Infant 3-Pack Game On Bodysuit Set - Black/Blue/Heathered Gray,$29.99
NFL,carolina-panthers,p-3238671,Christian McCaffrey Carolina Panthers Nike Infant Player Game Jersey - Black,$49.99
NFL,carolina-panthers,p-3237092,Christian McCaffrey Carolina Panthers Nike Infant Romper Jersey - Black,$24.99
NFL,carolina-panthers,p-3067342,Carolina Panthers New Era Newborn & Infant Mini Fan Knit Beanie - Blue,$19.99
NFL,carolina-panthers,p-3160889,Christian McCaffrey Carolina Panthers Infant Mainliner Name and Number Bodysuit - Black,$8.99
NFL,carolina-panthers,p-3975752,Carolina Panthers Newborn & Infant Little Player Long Sleeve 2-Pack Bodysuit Set - Blue/Black,$29.99
NFL,carolina-panthers,p-4270982,Carolina Panthers '47 Infant Bam Bam Cuffed Knit Hat with Pom and Mittens Set - Black/Blue,$29.99
NFL,carolina-panthers,p-3961113,Carolina Panthers Infant Champ 3-Pack Bodysuit Set - Black/Blue/Heathered Gray,$29.99
NFL,carolina-panthers,p-1324625,Carolina Panthers Newborn Piped Raglan Full Zip Coverall - Black,$24.99
NFL,carolina-panthers,p-4885710,Carolina Panthers Newborn Star Wars Stay On Target Bodysuit - Black,$21.99
NFL,carolina-panthers,p-4539031,"Carolina Panthers Girls Newborn & Infant All The Love Bodysuit, Bib & Booties Set - Black/Heathered Gray",$29.99
NFL,chicago-bears,p-3143061,"Chicago Bears Newborn & Infant Eat, Sleep, Drool Football Three-Piece Bodysuit Set - Navy/Orange",$20.99
NFL,chicago-bears,p-4333479,Justin Fields Chicago Bears Nike Infant Game Jersey - Navy,$49.99
NFL,chicago-bears,p-4537894,"Chicago Bears Dream Team Newborn & Infant Bodysuit, Pants & Hat Set - White/Navy",$29.99
NFL,chicago-bears,p-4560962,Justin Fields Chicago Bears Nike Newborn & Infant Game Romper Jersey - Navy,$49.99
NFL,chicago-bears,p-3889512,Chicago Bears '47 Infant Bam Bam Cuffed Knit Hat With Pom and Mittens Set - Navy/Orange,$29.99
NFL,chicago-bears,p-4542298,Chicago Bears Girls Newborn & Infant Cutest Fan Bodysuit - Pink,$19.99
NFL,chicago-bears,p-4490765,Chicago Bears Newborn & Infant Victory Formation Throwback Three-Piece Bodysuit and Knit Hat Set - Orange/Navy,$33.74
NFL,chicago-bears,p-4762018,Chicago Bears Infant Winning Streak T-Shirt - Navy,$12.99
NFL,chicago-bears,p-5016140,Justin Fields Chicago Bears Newborn & Infant Team Player Bodysuit - Navy,$22.99
NFL,chicago-bears,p-4260777,Chicago Bears Newborn & Infant Slouch Flex Hat - Navy,$18.99
NFL,chicago-bears,p-4471525,Walter Payton Chicago Bears Mitchell & Ness Infant 1985 Retired Legacy Jersey - Navy,$74.99
NFL,chicago-bears,p-4716993,Chicago Bears Newborn & Infant Monterey Tie-Dye 2-Pack Bodysuit Set - Orange/White,$21.99
NFL,chicago-bears,p-4538120,Chicago Bears Newborn & Infant Born To Win Two-Pack Long Sleeve Bodysuit Set - Navy/Heathered Gray,$29.99
NFL,chicago-bears,p-3548333,Khalil Mack Chicago Bears Nike Infant Romper Jersey - Navy,$21.99
NFL,chicago-bears,p-1324608,Chicago Bears Newborn Full Zip Raglan Coverall - Navy Blue,$24.99
NFL,chicago-bears,p-4538153,"Chicago Bears Newborn & Infant Little Champ Three-Piece Bodysuit, Bib & Booties Set - Navy/Orange",$29.99
NFL,chicago-bears,p-3419273,Chicago Bears New Era Newborn & Infant Mini Fan Knit Beanie - Navy,$19.99
NFL,chicago-bears,p-4539026,"Chicago Bears Girls Newborn & Infant All The Love Bodysuit, Bib & Booties Set - Navy/Heathered Gray",$29.99
NFL,chicago-bears,p-1346703,Chicago Bears Newborn & Infant Team Logo Bodysuit - Navy,$19.99
NFL,chicago-bears,p-4717098,Walter Payton Chicago Bears Mitchell & Ness Newborn & Infant Retro Name & Number Bodysuit - Navy,$27.99
NFL,chicago-bears,p-4222697,Chicago Bears New Era Newborn & Infant My 1st 9TWENTY Flex Hat - Navy,$19.99
NFL,chicago-bears,p-4539376,Chicago Bears Newborn & Infant Little Fan Bodysuit - Heathered Gray,$19.99
NFL,chicago-bears,p-4539345,Chicago Bears Infant Hand-Off T-Shirt - Navy,$15.99
NFL,chicago-bears,p-4539057,Chicago Bears Newborn & Infant Too Much Love Two-Piece Bodysuit Set - Navy/Orange,$29.99
NFL,chicago-bears,p-4449041,Justin Fields Chicago Bears Infant Mainliner Player Name & Number Bodysuit - Navy,$23.99
NFL,chicago-bears,p-1345459,Chicago Bears Infant Team Logo T-Shirt - Navy Blue,$15.99
NFL,chicago-bears,p-5015517,Infant Navy/Orange/Heather Gray Chicago Bears Three-Pack Team Wordmark Bodysuit Set,$27.99
NFL,chicago-bears,p-4449029,Justin Fields Chicago Bears Newborn & Infant Mainliner Player Name & Number Bodysuit - Navy,$23.99
NFL,chicago-bears,p-4291236,"Infant Navy/White Chicago Bears Team Knit Hat, Onesie and Footed Sleeper Set",$24.99
NFL,chicago-bears,p-3587060,Chicago Bears Girls Newborn Lil' Princess Bodysuit and Tutu Leggings Set - White/Pink,$27.99
NFL,chicago-bears,p-4430790,Newborn & Infant Navy/Orange/Heathered Gray Chicago Bears Three-Piece Bodysuit Set,$26.99
NFL,chicago-bears,p-5015313,Newborn & Infant Navy Chicago Bears Allover Print Full-Zip Footed Jumper,$18.00
NFL,chicago-bears,p-4294769,Infant Navy Chicago Bears Football T-Shirt,$10.99
NFL,chicago-bears,p-3879454,Chicago Bears Infant's My First Pixel Slouch Flex Hat - Orange,$14.99
NFL,chicago-bears,p-4538995,Chicago Bears Girls Infant Heart to Heart Jersey Tri-Blend Dress - Navy/Orange,$29.99
NFL,chicago-bears,p-4260760,Chicago Bears Infant Shearling Ears Hat & Mittens Set,$39.99
NFL,chicago-bears,p-4953743,"Chicago Bears Mitchell & Ness Newborn & Infant Throwback Bodysuit, Bib & Booties Set - Navy/Orange",$44.99
NFL,chicago-bears,p-3143092,Chicago Bears Girls Infant Cheer Captain Jumper Dress - Navy/Orange,$31.99
NFL,chicago-bears,p-4222929,Chicago Bears New Era Infant Cutie Cuffed Knit Hat - White,$19.99
NFL,chicago-bears,p-4478500,Girls Newborn & Infant Navy/Orange Chicago Bears Two-Piece Cheerleader Set with Bloomers,$24.97
NFL,chicago-bears,p-1324755,Chicago Bears Infant Piped Full Zip Raglan Sleeper - Navy Blue,$24.99
NFL,chicago-bears,p-3972103,"Chicago Bears Newborn & Infant Tackle Bodysuit, Bib & Booties Set - Navy",$29.99
