Sport,Team,Product ID,Product Name,Product Price
NFL,new-orleans-saints,p-3238672,Alvin Kamara New Orleans Saints Nike Infant Player Game Jersey - Black,$49.99
NFL,new-orleans-saints,p-3998165,Alvin Kamara New Orleans Saints Nike Newborn & Infant Romper Jersey - Black,$49.99
NFL,new-orleans-saints,p-4260786,New Orleans Saints Newborn & Infant Slouch Flex Hat - Black,$14.99
NFL,new-orleans-saints,p-4762034,New Orleans Saints Infant Winning Streak T-Shirt - Black,$12.99
NFL,new-orleans-saints,p-4538175,"New Orleans Saints Newborn & Infant Little Champ Three-Piece Bodysuit, Bib & Booties Set - Black/Gold",$29.99
NFL,new-orleans-saints,p-4537913,"New Orleans Saints Dream Team Newborn & Infant Bodysuit, Pants & Hat Set - White/",$29.99
NFL,new-orleans-saints,p-4067898,New Orleans Saints New Era Newborn & Infant My 1st 9TWENTY Flex Hat - Black,$18.99
NFL,new-orleans-saints,p-4683052,New Orleans Saints New Era Infant Mini Fan Beanie - Black,$19.99
NFL,new-orleans-saints,p-3470786,Alvin Kamara New Orleans Saints Newborn Mainliner Name & Number Bodysuit - Black,$23.99
NFL,new-orleans-saints,p-2499352,New Orleans Saints WinCraft Infant Lil Fan All Pro Baby Bib,$7.49
NFL,new-orleans-saints,p-3879468,New Orleans Saints Infant's My First Pixel Slouch Flex Hat - Gold,$14.99
NFL,new-orleans-saints,p-4981892,New Orleans Saints Infant Tailgate Tutu Game Day Costume Set - Black,$34.99
NFL,new-orleans-saints,p-4539045,"New Orleans Saints Girls Newborn & Infant All The Love Bodysuit, Bib & Booties Set - Black/Heathered Gray",$29.99
NFL,new-orleans-saints,p-1346725,New Orleans Saints Newborn & Infant Team Logo Bodysuit - Black,$19.99
NFL,new-orleans-saints,p-3587071,New Orleans Saints Girls Newborn Lil' Princess Bodysuit and Tutu Leggings Set - White/Pink,$27.99
NFL,new-orleans-saints,p-4430740,"Girls Infant White/Black New Orleans Saints Bodysuit, Bib & Booties Set",$26.99
NFL,new-orleans-saints,p-4478480,Girls Newborn & Infant Black/Gold/White New Orleans Saints Three-Piece Bodysuit Set,$26.99
NFL,new-orleans-saints,p-4067887,New Orleans Saints New Era Infant My 1st 9FIFTY Adjustable Hat - Black/Vegas Gold,$23.99
NFL,new-orleans-saints,p-4537975,New Orleans Saints Newborn & Infant Game Nap Teddy Fleece Bunting Full-Zip Sleeper - Black/Gray,$39.99
NFL,new-orleans-saints,p-4478451,Newborn & Infant Black New Orleans Saints Sherpa Full-Zip Sleeper,$29.99
NFL,new-orleans-saints,p-4291272,"New Orleans Saints Newborn & Infant Bodysuit, Bib & Cap Set - Black/White",$19.99
NFL,new-orleans-saints,p-4430798,Newborn & Infant Black/Gold/Heathered Gray New Orleans Saints Three-Piece Bodysuit Set,$26.99
NFL,new-orleans-saints,p-4478470,Newborn & Infant Black New Orleans Saints Bodysuit,$19.99
NFL,new-orleans-saints,p-5015548,Newborn & Infant New Orleans Saints Cream Logo Hoodie Full-Zip Sleeper,$30.00
NFL,new-orleans-saints,p-4478513,Girls Newborn & Infant Black/Gold New Orleans Saints Two-Piece Cheerleader Set with Bloomers,$24.97
NFL,new-orleans-saints,p-4885696,New Orleans Saints Newborn & Infant Disney Lil Champ Bodysuit - Black,$21.99
NFL,new-orleans-saints,p-4538006,New Orleans Saints Girls Newborn & Infant Spreading Love Bodysuit and Tutu Leggings Set - White,$29.99
NFL,new-orleans-saints,p-3889521,New Orleans Saints '47 Infant Bam Bam Cuffed Knit Hat With Pom and Mittens Set - Black/Gold,$29.99
NFL,new-orleans-saints,p-3730441,Michael Thomas New Orleans Saints Infant Mainliner Name & Number Bodysuit - Black,$23.99
NFL,new-orleans-saints,p-4538143,New Orleans Saints Newborn & Infant Born To Win Two-Pack Long Sleeve Bodysuit Set - Black/Heathered Gray,$29.99
NFL,new-orleans-saints,p-3730421,Michael Thomas New Orleans Saints Newborn & Infant Mainliner Name & Number Bodysuit - Black,$23.99
NFL,new-orleans-saints,p-4753160,New Orleans Saints WinCraft Newborn & Infant Rainbow Baby Bib,$8.24
NFL,new-orleans-saints,p-2850954,New Orleans Saints Girls Infant Celebration Tutu Sequins Dress - Black,$19.99
NFL,new-orleans-saints,p-3238673,Drew Brees New Orleans Saints Nike Infant Player Game Jersey - Black,$49.99
NFL,new-orleans-saints,p-3965443,Alvin Kamara New Orleans Saints Infant Mainliner Player Name & Number Bodysuit - Black,$23.99
NFL,new-orleans-saints,p-1345475,New Orleans Saints Infant Team Logo T-Shirt - Black,$15.99
NFL,new-orleans-saints,p-3162623,Drew Brees New Orleans Saints Newborn Mainliner Name & Number Bodysuit - Black,$21.99
NFL,new-orleans-saints,p-4222939,New Orleans Saints New Era Infant Cutie Cuffed Knit Hat - White,$19.99
NFL,new-orleans-saints,p-4260768,New Orleans Saints Infant Shearling Ears Hat & Mittens Set,$39.99
NFL,new-orleans-saints,p-3160892,Drew Brees New Orleans Saints Infant Mainliner Name and Number Bodysuit - Black,$21.99
NFL,new-orleans-saints,p-4294781,Infant Black New Orleans Saints Football T-Shirt,$10.99
NFL,new-orleans-saints,p-4563972,New Orleans Saints Infant Banded Long Sleeve Holiday Pajamas Full-Zip Jumper - Vegas Gold,$31.99
NFL,new-orleans-saints,p-4430704,"Newborn & Infant Black New Orleans Saints Bodysuit, Booties, Hat & Pants Set",$26.99
NFL,new-orleans-saints,p-3960813,New Orleans Saints Girls Infant All Hearts Jersey Long Sleeve Dress - Black,$29.99
NFL,new-orleans-saints,p-4542280,New Orleans Saints Infant 3-Pack Game On Bodysuit Set - Black/Gold/Heathered Gray,$29.99
NFL,new-orleans-saints,p-3998154,Michael Thomas New Orleans Saints Nike Infant Game Jersey - Black,$49.99
NFL,new-orleans-saints,p-4717004,New Orleans Saints Newborn & Infant Monterey Tie-Dye 2-Pack Bodysuit Set - Black/White,$21.99
NFL,new-orleans-saints,p-5016150,Jameis Winston New Orleans Saints Newborn & Infant Team Player Bodysuit - Black,$22.99
NFL,new-orleans-saints,p-3998164,Michael Thomas New Orleans Saints Nike Newborn & Infant Romper Jersey - Black,$49.99
NFL,new-orleans-saints,p-5015528,Newborn & Infant Black/Gold/Heather Gray New Orleans Saints Three-Pack Team Wordmark Bodysuit Set,$27.99
NFL,new-orleans-saints,p-4539076,New Orleans Saints Newborn & Infant Too Much Love Two-Piece Bodysuit Set - Black/Vegas Gold,$29.99
NFL,new-orleans-saints,p-4427479,New Orleans Saints New Era Infant Team My First 9TWENTY Flex Hat - Black,$19.99
NFL,new-orleans-saints,p-1324775,New Orleans Saints Infant Piped Raglan Full Zip Coverall - Black,$24.99
NFL,new-orleans-saints,p-3961127,New Orleans Saints Infant Champ 3-Pack Bodysuit Set - Black/Gold/Heathered Gray,$29.99
NFL,new-orleans-saints,p-4538111,New Orleans Saints Infant Little Kicker Long Sleeve Bodysuit & Pants Set - Black/Gold,$29.99
NFL,new-orleans-saints,p-4064580,New Orleans Saints Girls Infant Too Cute Long Sleeve Bodysuit & Pants Set - Red,$16.99
NFL,new-orleans-saints,p-3975763,New Orleans Saints Newborn & Infant Little Player Long Sleeve 2-Pack Bodysuit Set - Gold/Black,$29.99
NFL,new-orleans-saints,p-4539014,New Orleans Saints Girls Infant Heart to Heart Jersey Tri-Blend Dress - Black/Gold,$29.99
NFL,new-york-giants,p-3143072,"New York Giants Newborn & Infant Eat, Sleep, Drool Football Three-Piece Bodysuit Set - Royal/Red",$20.99
NFL,new-york-giants,p-4538164,"New York Giants Newborn & Infant Little Champ Three-Piece Bodysuit, Bib & Booties Set - Royal/Red",$29.99
NFL,new-york-giants,p-4539069,New York Giants Newborn & Infant Too Much Love Two-Piece Bodysuit Set - Royal/Red,$29.99
NFL,new-york-giants,p-4539038,"New York Giants Girls Newborn & Infant All The Love Bodysuit, Bib & Booties Set - Royal/Heathered Gray",$29.99
NFL,new-york-giants,p-1346715,New York Giants Newborn & Infant Team Logo Bodysuit - Royal,$19.99
NFL,new-york-giants,p-1345468,New York Giants Infant Team Logo T-Shirt - Royal Blue,$15.99
NFL,new-york-giants,p-4539007,New York Giants Girls Infant Heart to Heart Jersey Tri-Blend Dress - Royal/Red,$29.99
NFL,new-york-giants,p-4538132,New York Giants Newborn & Infant Born To Win Two-Pack Long Sleeve Bodysuit Set - Royal/Heathered Gray,$29.99
NFL,new-york-giants,p-4537968,New York Giants Newborn & Infant Game Nap Teddy Fleece Bunting Full-Zip Sleeper - Royal/Gray,$39.99
NFL,new-york-giants,p-1324620,New York Giants Newborn Full Zip Raglan Coverall - Royal Blue,$24.99
NFL,new-york-giants,p-3149676,Saquon Barkley New York Giants Nike Infant Game Jersey - Royal,$49.99
NFL,new-york-giants,p-4064575,New York Giants Girls Infant Too Cute Long Sleeve Bodysuit & Pants Set - Red,$19.99
NFL,new-york-giants,p-3143102,New York Giants Girls Infant Cheer Captain Jumper Dress - Royal/Red,$31.99
NFL,new-york-giants,p-3962229,"New York Giants Newborn & Infant Ready, Set, Nap Three-Pack Bodysuit Set - Royal/Red/Heathered Gray",$26.99
NFL,new-york-giants,p-3419306,New York Giants New Era Infant Pattern Cuffed Knit Hat - Pink,$12.99
NFL,new-york-giants,p-3587065,New York Giants Girls Newborn Lil' Princess Bodysuit and Tutu Leggings Set - White/Pink,$27.99
NFL,new-york-giants,p-3024488,New York Giants Infant Yardline Ringer Tee Dress - Pink,$14.99
NFL,new-york-giants,p-4222947,New York Giants New Era Infant Cutie Cuffed Knit Hat - White,$19.99
NFL,new-york-jets,p-200057853,Aaron Rodgers New York Jets Infant Player Name & Number Bodysuit - Green,$23.99
NFL,new-york-jets,p-200057866,Aaron Rodgers New York Jets Newborn Player Name & Number Bodysuit - Black,$23.99
NFL,new-york-jets,p-4939013,"New York Jets Newborn & Infant Three-Piece Eat, Sleep, Drool Bodysuit Set - Green/Black/Heathered Gray",$29.99
NFL,new-york-jets,p-200081342,Ahmad Sauce Gardner New York Jets Infant Mainliner Player Name & Number Bodysuit - Green,$23.99
NFL,new-york-jets,p-200081553,Ahmad Sauce Gardner New York Jets Newborn & Infant Mainliner Player Name & Number Bodysuit - Green,$23.99
NFL,new-york-jets,p-4539070,New York Jets Newborn & Infant Too Much Love Two-Piece Bodysuit Set - Green/Black,$29.99
NFL,new-york-jets,p-3581853,New York Jets Newborn & Infant Raglan Full-Zip Sleeper - Green,$24.99
NFL,new-york-jets,p-4981893,New York Jets Infant Tailgate Tutu Game Day Costume Set - Green/White,$34.99
NFL,new-york-jets,p-4539039,"New York Jets Girls Newborn & Infant All The Love Bodysuit, Bib & Booties Set - Green/Heathered Gray",$29.99
NFL,new-york-jets,p-4538134,New York Jets Newborn & Infant Born To Win Two-Pack Long Sleeve Bodysuit Set - Green/Heathered Gray,$29.99
NFL,new-york-jets,p-3488389,Sam Darnold New York Jets Nike Infant Game Jersey - Gotham Green,$44.99
NFL,new-york-jets,p-3972114,"New York Jets Newborn & Infant Tackle Bodysuit, Bib & Booties Set - Green",$29.99
NFL,new-york-jets,p-4537907,"New York Jets Dream Team Newborn & Infant Bodysuit, Pants & Hat Set - White/Green",$29.99
NFL,new-york-jets,p-3488391,Sam Darnold New York Jets Nike Infant Romper Jersey - Green,$21.99
NFL,new-york-jets,p-4542274,New York Jets Infant 3-Pack Game On Bodysuit Set - Green/Black/Heathered Gray,$29.99
NFL,new-york-jets,p-4358716,Zach Wilson New York Jets Nike Infant Game Jersey - Gotham Green,$49.99
NFL,new-york-jets,p-4538166,"New York Jets Newborn & Infant Little Champ Three-Piece Bodysuit, Bib & Booties Set - Green/Black",$29.99
NFL,new-york-jets,p-3581852,New York Jets Infant Raglan Full-Zip Sleeper - Green,$24.99
NFL,philadelphia-eagles,p-3143070,"Philadelphia Eagles Newborn & Infant Eat, Sleep, Drool Football Three-Piece Bodysuit Set - Midnight Green/Black",$29.99
NFL,philadelphia-eagles,p-5340085,Philadelphia Eagles Newborn & Infant Two-Pack Double Up Bodysuit Set - Midnight Green/Gray,$25.99
NFL,philadelphia-eagles,p-2069413,Philadelphia Eagles Newborn & Infant Team Logo Bodysuit - Black,$19.99
NFL,philadelphia-eagles,p-4538162,"Philadelphia Eagles Newborn & Infant Little Champ Three-Piece Bodysuit, Bib & Booties Set - Midnight Green/Heathered Gray",$29.99
NFL,philadelphia-eagles,p-1324765,Philadelphia Eagles Infant Piped Raglan Full Zip Coverall - Midnight Green,$24.99
NFL,philadelphia-eagles,p-4539003,Philadelphia Eagles Girls Infant Heart to Heart Jersey Tri-Blend Dress - Midnight Green/Heather Gray,$29.99
NFL,philadelphia-eagles,p-3143100,Philadelphia Eagles Girls Infant Cheer Captain Jumper Dress - Midnight Green/Black,$31.99
NFL,philadelphia-eagles,p-4538098,Philadelphia Eagles Infant Little Kicker Long Sleeve Bodysuit & Pants Set - Midnight Green/Heathered Gray,$29.99
NFL,philadelphia-eagles,p-4556176,Philadelphia Eagles Infant My First Tail Sweep Slouch Flex Hat - Midnight Green/Black,$19.99
NFL,philadelphia-eagles,p-4478505,Girls Newborn & Infant Midnight Green/Black Philadelphia Eagles Two-Piece Cheerleader Set with Bloomers,$24.97
NFL,philadelphia-eagles,p-4683055,Philadelphia Eagles New Era Infant Mini Fan Beanie - Midnight Green,$19.99
NFL,philadelphia-eagles,p-5305921,Philadelphia Eagles Newborn Super Bowl LVII My First Super Bowl Bodysuit - Black,$14.99
NFL,pittsburgh-steelers,p-3143086,"Pittsburgh Steelers Newborn & Infant Eat, Sleep, Drool Football Three-Piece Bodysuit Set - Black/Gold",$29.99
NFL,pittsburgh-steelers,p-4408964,T.J. Watt Pittsburgh Steelers Nike Infant Game Romper Jersey - Black,$49.99
NFL,pittsburgh-steelers,p-4560759,Najee Harris Pittsburgh Steelers Nike Infant Player Game Jersey - Black,$49.99
NFL,pittsburgh-steelers,p-4538177,"Pittsburgh Steelers Newborn & Infant Little Champ Three-Piece Bodysuit, Bib & Booties Set - Black/Gold",$29.99
NFL,pittsburgh-steelers,p-5016152,T.J. Watt Pittsburgh Steelers Newborn & Infant Team Player Bodysuit - Black,$22.99
NFL,pittsburgh-steelers,p-4762036,Pittsburgh Steelers Infant Winning Streak T-Shirt - Black,$12.99
NFL,pittsburgh-steelers,p-4067884,Pittsburgh Steelers New Era Infant My 1st 9FIFTY Adjustable Hat - Black/Gold,$23.99
NFL,pittsburgh-steelers,p-5340090,Pittsburgh Steelers Newborn & Infant Two-Pack Double Up Bodysuit Set - Black/Gray,$25.99
NFL,pittsburgh-steelers,p-4542319,Pittsburgh Steelers Girls Newborn & Infant Cutest Fan Bodysuit - Pink,$19.99
NFL,pittsburgh-steelers,p-3143114,Pittsburgh Steelers Girls Infant Cheer Captain Jumper Dress - Black/Gold,$31.99
NFL,pittsburgh-steelers,p-4538145,Pittsburgh Steelers Newborn & Infant Born To Win Two-Pack Long Sleeve Bodysuit Set - Black/Heathered Gray,$29.99
NFL,pittsburgh-steelers,p-4406715,Chase Claypool Pittsburgh Steelers Nike Infant Game Jersey - Black,$24.99
NFL,pittsburgh-steelers,p-4560968,Najee Harris Pittsburgh Steelers Nike Newborn & Infant Game Romper Jersey - Black,$49.99
NFL,pittsburgh-steelers,p-4538008,Pittsburgh Steelers Girls Newborn & Infant Spreading Love Bodysuit and Tutu Leggings Set - White,$29.99
NFL,pittsburgh-steelers,p-4556184,Pittsburgh Steelers Infant My First Tail Sweep Slouch Flex Hat - Black/Gold,$19.99
NFL,pittsburgh-steelers,p-4537915,"Pittsburgh Steelers Dream Team Newborn & Infant Bodysuit, Pants & Hat Set - White/Black",$29.99
NFL,pittsburgh-steelers,p-4539397,Pittsburgh Steelers Newborn & Infant Little Fan Bodysuit - Heathered Gray,$19.99
NFL,pittsburgh-steelers,p-3238676,T.J. Watt Pittsburgh Steelers Nike Infant Player Game Jersey - Black,$49.99
NFL,pittsburgh-steelers,p-1346728,Pittsburgh Steelers Newborn & Infant Team Logo Bodysuit - Black,$19.99
NFL,pittsburgh-steelers,p-4539078,Pittsburgh Steelers Newborn & Infant Too Much Love Two-Piece Bodysuit Set - Black/Gold,$29.99
NFL,pittsburgh-steelers,p-4260788,Pittsburgh Steelers Newborn & Infant Slouch Flex Hat - Black,$19.99
NFL,pittsburgh-steelers,p-4683276,Pittsburgh Steelers New Era Infant Critter Cuffed Knit Hat - Heather Gray,$21.99
NFL,pittsburgh-steelers,p-4294783,Infant Black Pittsburgh Steelers Football T-Shirt,$10.99
NFL,pittsburgh-steelers,p-4539047,"Pittsburgh Steelers Girls Newborn & Infant All The Love Bodysuit, Bib & Booties Set - Black/Heathered Gray",$29.99
NFL,pittsburgh-steelers,p-4478453,Newborn & Infant Black Pittsburgh Steelers Sherpa Full-Zip Sleeper,$29.99
NFL,pittsburgh-steelers,p-1345478,Pittsburgh Steelers Infant Team Logo T-Shirt - Black,$15.99
NFL,pittsburgh-steelers,p-4260770,Pittsburgh Steelers Infant Shearling Ears Hat & Mittens Set,$39.99
NFL,pittsburgh-steelers,p-4885698,Pittsburgh Steelers Newborn & Infant Disney Lil Champ Bodysuit - Black,$21.99
NFL,pittsburgh-steelers,p-4088603,T.J. Watt Pittsburgh Steelers Infant Mainliner Player Name & Number Bodysuit - Black,$23.99
NFL,pittsburgh-steelers,p-5015550,Newborn & Infant Pittsburgh Steelers Cream Logo Hoodie Full-Zip Sleeper,$30.00
NFL,pittsburgh-steelers,p-4717101,Troy Polamalu Pittsburgh Steelers Mitchell & Ness Newborn & Infant Retro Name & Number Bodysuit - Black,$27.99
NFL,pittsburgh-steelers,p-4885716,Pittsburgh Steelers Newborn Star Wars Stay On Target Bodysuit - Black,$21.99
NFL,pittsburgh-steelers,p-3962239,"Pittsburgh Steelers Newborn & Infant Ready, Set, Nap Three-Pack Bodysuit Set - Black/Gold/Heathered Gray",$26.99
NFL,pittsburgh-steelers,p-4683054,Pittsburgh Steelers New Era Infant Mini Fan Beanie -  Black,$19.99
NFL,pittsburgh-steelers,p-4064582,Pittsburgh Steelers Girls Infant Too Cute Long Sleeve Bodysuit & Pants Set - Red,$17.99
NFL,pittsburgh-steelers,p-4430742,"Girls Infant White/Black Pittsburgh Steelers Bodysuit, Bib & Booties Set",$26.99
NFL,pittsburgh-steelers,p-1355373,Antonio Brown Pittsburgh Steelers Nike Infant Team Color Game Jersey - Black,$21.99
NFL,pittsburgh-steelers,p-4408965,Chase Claypool Pittsburgh Steelers Nike Infant Game Romper Jersey - Black,$18.99
NFL,pittsburgh-steelers,p-4981895,Pittsburgh Steelers Infant Tailgate Tutu Game Day Costume Set - Black,$34.99
NFL,pittsburgh-steelers,p-1324633,Pittsburgh Steelers Newborn Full Zip Raglan Coverall - Black,$24.99
NFL,pittsburgh-steelers,p-3587073,Pittsburgh Steelers Girls Newborn Lil' Princess Bodysuit and Tutu Leggings Set - White/Pink,$27.99
NFL,pittsburgh-steelers,p-3889526,Pittsburgh Steelers '47 Infant Bam Bam Cuffed Knit Hat With Pom and Mittens Set - Black/Gold,$29.99
NFL,pittsburgh-steelers,p-4539016,Pittsburgh Steelers Girls Infant Heart to Heart Jersey Tri-Blend Dress - Black/Gold,$29.99
NFL,pittsburgh-steelers,p-2418613,Pittsburgh Steelers New Era Infant My 1st 9FIFTY Snapback Adjustable Hat - Black/Gold,$15.99
NFL,pittsburgh-steelers,p-4471554,Troy Polamalu Pittsburgh Steelers Mitchell & Ness Infant 2005 Retired Legacy Jersey - Black,$74.99
NFL,pittsburgh-steelers,p-3975765,Pittsburgh Steelers Newborn & Infant Little Player Long Sleeve 2-Pack Bodysuit Set - Gold/Black,$29.99
NFL,pittsburgh-steelers,p-4623606,Pittsburgh Steelers Infant 2-Pack Snug as a Bug Full-Zip Sleeveless Swaddle Set - Black/White,$49.99
NFL,pittsburgh-steelers,p-4222931,Pittsburgh Steelers New Era Infant Cutie Cuffed Knit Hat - White,$19.99
NFL,pittsburgh-steelers,p-3972063,"Pittsburgh Steelers Newborn & Infant Play Your Best Bodysuit, Bib & Booties Set - Black",$29.99
NFL,san-francisco-49-ers,p-3143059,"San Francisco 49ers Newborn & Infant Eat, Sleep, Drool Football Three-Piece Bodysuit Set - Scarlet/Gold",$29.99
NFL,san-francisco-49-ers,p-4538151,"San Francisco 49ers Newborn & Infant Little Champ Three-Piece Bodysuit, Bib & Booties Set - Scarlet/Gold",$29.99
NFL,san-francisco-49-ers,p-4848354,Trey Lance San Francisco 49ers Nike Infant Romper Game Jersey - Scarlet,$49.99
NFL,san-francisco-49-ers,p-200081346,Christian McCaffrey San Francisco 49ers Newborn & Infant Mainliner Player Name & Number Bodysuit - Scarlet,$23.99
NFL,san-francisco-49-ers,p-1345458,San Francisco 49ers Infant Team Logo T-Shirt - Scarlet,$15.99
NFL,san-francisco-49-ers,p-5340075,San Francisco 49ers Newborn & Infant Two-Pack Double Up Bodysuit Set - Scarlet/Gray,$25.99
NFL,san-francisco-49-ers,p-2499284,San Francisco 49ers WinCraft Infant Lil Fan All Pro Baby Bib,$7.49
NFL,san-francisco-49-ers,p-4560756,Trey Lance San Francisco 49ers Nike Infant Player Game Jersey - Scarlet,$49.99
NFL,san-francisco-49-ers,p-5101621,Deebo Samuel San Francisco 49ers Newborn & Infant Mainliner Player Name & Number Bodysuit - Scarlet,$23.99
NFL,san-francisco-49-ers,p-200081338,Christian McCaffrey San Francisco 49ers Infant Mainliner Player Name & Number Bodysuit - Scarlet,$23.99
NFL,san-francisco-49-ers,p-2068759,San Francisco 49ers Newborn & Infant Team Logo Bodysuit - Black,$19.99
NFL,san-francisco-49-ers,p-4537981,San Francisco 49ers Girls Newborn & Infant Spreading Love Bodysuit and Tutu Leggings Set - White,$29.99
NFL,san-francisco-49-ers,p-5101613,Deebo Samuel San Francisco 49ers Infant Mainliner Player Name & Number Bodysuit - Scarlet,$23.99
NFL,san-francisco-49-ers,p-4717097,Jerry Rice San Francisco 49ers Mitchell & Ness Newborn & Infant Retro Name & Number Bodysuit - Scarlet,$27.99
NFL,san-francisco-49-ers,p-4762013,San Francisco 49ers Infant Winning Streak T-Shirt - Black,$12.99
NFL,san-francisco-49-ers,p-3998143,George Kittle San Francisco 49ers Nike Infant Game Jersey - Scarlet,$33.99
NFL,seattle-seahawks,p-4347701,Seattle Seahawks Newborn & Infant 3rd Down & Goal Three-Piece Bodysuit Set - College Navy/Neon Green/Heathered Gray,$20.99
NFL,seattle-seahawks,p-1584189,Russell Wilson Seattle Seahawks Nike Infant Team Color Game Jersey - College Navy,$15.99
NFL,seattle-seahawks,p-4294782,Infant College Navy Seattle Seahawks Football T-Shirt,$4.99
NFL,seattle-seahawks,p-4406714,DK Metcalf Seattle Seahawks Nike Infant Game Jersey - College Navy,$49.99
NFL,seattle-seahawks,p-4294912,Infant College Navy Seattle Seahawks Team Raglan T-Shirt,$4.99
NFL,seattle-seahawks,p-1324631,Seattle Seahawks Newborn Piped Raglan Full Zip Coverall - College Navy,$24.99
NFL,seattle-seahawks,p-3172622,Girls Newborn & Infant Neon Green/White Seattle Seahawks 2-Pack Long Sleeve Bodysuits,$9.99
NFL,seattle-seahawks,p-3103560,"Girls Infant White/College Navy Seattle Seahawks Bodysuit, Pants & Cap Set",$13.99
NFL,seattle-seahawks,p-4067909,Seattle Seahawks New Era Newborn & Infant My 1st 9TWENTY Flex Hat - College Navy,$14.99
NFL,seattle-seahawks,p-4291273,"Seattle Seahawks Newborn & Infant Bodysuit, Bib & Cap Set - College Navy/White",$14.99
NFL,seattle-seahawks,p-4260787,Seattle Seahawks Newborn & Infant Slouch Flex Hat - College Navy,$16.99
NFL,seattle-seahawks,p-4430705,"Newborn & Infant College Navy Seattle Seahawks Bodysuit, Booties, Hat & Pants Set",$19.99
NFL,seattle-seahawks,p-3143084,"Seattle Seahawks Newborn & Infant Eat, Sleep, Drool Football Three-Piece Bodysuit Set - Navy/Neon Green",$29.99
NFL,seattle-seahawks,p-4539046,"Seattle Seahawks Girls Newborn & Infant All The Love Bodysuit, Bib & Booties Set - College Navy/Heathered Gray",$29.99
NFL,seattle-seahawks,p-3539035,Girls Infant College Navy/Neon Green/White Seattle Seahawks Three-Piece Bodysuit Set,$11.99
NFL,seattle-seahawks,p-4538176,"Seattle Seahawks Newborn & Infant Little Champ Three-Piece Bodysuit, Bib & Booties Set - College Navy/Neon Green",$29.99
NFL,seattle-seahawks,p-2069411,Seattle Seahawks Infant Team Logo T-Shirt - Neon Green,$15.99
NFL,seattle-seahawks,p-4260678,DK Metcalf Seattle Seahawks Newborn & Infant Mainliner Player Name & Number Bodysuit - College Navy,$23.99
NFL,seattle-seahawks,p-5015325,Newborn & Infant College Navy Seattle Seahawks Allover Print Full-Zip Footed Jumper,$18.00
NFL,seattle-seahawks,p-4478452,Newborn & Infant College Navy Seattle Seahawks Sherpa Full-Zip Sleeper,$16.99
NFL,seattle-seahawks,p-5015549,Newborn & Infant Seattle Seahawks Cream Logo Hoodie Full-Zip Sleeper,$30.00
NFL,seattle-seahawks,p-3172020,Newborn & Infant College Navy/Neon Green/Gray Seattle Seahawks Rookie 3-Pack Bodysuit Set,$13.99
NFL,seattle-seahawks,p-4260686,DK Metcalf Seattle Seahawks Infant Mainliner Player Name & Number Bodysuit - College Navy,$23.99
NFL,seattle-seahawks,p-3172632,Girls Newborn & Infant College Navy/Neon Green/White Seattle Seahawks Team 3-Pack Bodysuit Set,$14.99
NFL,seattle-seahawks,p-5015529,Newborn & Infant College Navy/Neon Green/Heather Gray Seattle Seahawks Three-Pack Team Wordmark Bodysuit Set,$27.99
NFL,seattle-seahawks,p-4064581,Seattle Seahawks Girls Infant Too Cute Long Sleeve Bodysuit & Pants Set - Red,$17.99
NFL,seattle-seahawks,p-3889528,Seattle Seahawks '47 Infant Bam Bam Cuffed Knit Hat With Pom and Mittens Set - College Navy/Neon Green,$29.99
NFL,seattle-seahawks,p-5016153,Seattle Seahawks Newborn & Infant Team Player Bodysuit - College Navy,$22.99
NFL,seattle-seahawks,p-1345476,Seattle Seahawks Infant Team Logo T-Shirt - College Navy,$15.99
NFL,seattle-seahawks,p-3103590,Infant Gerber Black Seattle Seahawks Stadium T-Shirt,$3.99
NFL,seattle-seahawks,p-4537914,"Seattle Seahawks Dream Team Newborn & Infant Bodysuit, Pants & Hat Set - White/",$29.99
NFL,seattle-seahawks,p-3174093,Newborn & Infant College Navy Seattle Seahawks Receiver T-Shirt,$5.99
NFL,seattle-seahawks,p-1324776,Seattle Seahawks Infant Piped Raglan Full Zip Coverall - College Navy,$24.99
NFL,seattle-seahawks,p-3419282,Seattle Seahawks New Era Newborn & Infant Mini Fan Knit Beanie - College Navy,$19.99
NFL,seattle-seahawks,p-4539015,Seattle Seahawks Girls Infant Heart to Heart Jersey Tri-Blend Dress - College Navy/Neon Green,$29.99
NFL,seattle-seahawks,p-4981897,Seattle Seahawks Infant Tailgate Tutu Game Day Costume Set - College Navy,$34.99
NFL,seattle-seahawks,p-4542318,Seattle Seahawks Girls Newborn & Infant Cutest Fan Bodysuit - Pink,$19.99
NFL,seattle-seahawks,p-4539077,Seattle Seahawks Newborn & Infant Too Much Love Two-Piece Bodysuit Set - College Navy/Neon Green,$29.99
NFL,seattle-seahawks,p-4538144,Seattle Seahawks Newborn & Infant Born To Win Two-Pack Long Sleeve Bodysuit Set - College Navy/Heathered Gray,$29.99
NFL,seattle-seahawks,p-3972092,Seattle Seahawks Girls Newborn Two-Pack Touchdown Bodysuit Set - Neon Green/Navy,$29.99
NFL,seattle-seahawks,p-3174103,Newborn & Infant White/Navy Seattle Seahawks Long Sleeve Pants Set,$13.99
NFL,seattle-seahawks,p-4067893,Seattle Seahawks New Era Infant My 1st 9FIFTY Adjustable Hat - College Navy/Neon Green,$23.99
NFL,seattle-seahawks,p-1346726,Seattle Seahawks Newborn & Infant Team Logo Bodysuit - Navy,$19.99
NFL,seattle-seahawks,p-4478514,Girls Newborn & Infant College Navy/Neon Green Seattle Seahawks Two-Piece Cheerleader Set with Bloomers,$24.97
NFL,seattle-seahawks,p-4430694,Seattle Seahawks Girls Newborn & Infant Three-Piece Bodysuit Set - Navy/Neon Green/White,$26.99
